,Title,Description,Genre,Actors,Director,rating,Year,Runtime (Minutes)
1501,Mr. Nobody,"A boy stands on a station platform as a train is about to leave. Should he go with his mother or stay with his father? Infinite possibilities arise from this decision. As long as he doesn't choose, anything is possible.","Drama,Fantasy,Romance","Jared Leto, Sarah Polley, Diane Kruger, Linh Dan Pham",Jaco Van Dormael,,2009,141
1502,City of Tiny Lights,"In the teeming, multicultural metropolis of modern-day London, a seemingly straightforward missing-person case launches a down-at-heel private eye into a dangerous world of religious fanaticism and political intrigue.","Crime,Drama,Thriller","Riz Ahmed, Billie Piper, James Floyd, Cush Jumbo",Pete Travis,,2016,110
1503,Savages,Pot growers Ben and Chon face off against the Mexican drug cartel who kidnapped their shared girlfriend.,"Crime,Drama,Thriller","Aaron Taylor-Johnson, Taylor Kitsch, Blake Lively,Benicio Del Toro",Oliver Stone,,2012,131
1504,(500) Days of Summer,"An offbeat romantic comedy about a woman who doesn't believe true love exists, and the young man who falls for her.","Comedy,Drama,Romance","Zooey Deschanel, Joseph Gordon-Levitt, Geoffrey Arend, Chlo Grace Moretz",Marc Webb,,2009,95
1505,Movie 43,A series of interconnected short films follows a washed-up producer as he pitches insane story lines featuring some of the biggest stars in Hollywood.,"Comedy,Romance","Emma Stone, Stephen Merchant, Richard Gere, Liev Schreiber",Elizabeth Banks,,2013,94
1506,Gravity,Two astronauts work together to survive after an accident which leaves them alone in space.,"Drama,Sci-Fi,Thriller","Sandra Bullock, George Clooney, Ed Harris, Orto Ignatiussen",Alfonso Cuarn,,2013,91
1507,The Boy in the Striped Pyjamas,"Set during WWII, a story seen through the innocent eyes of Bruno, the eight-year-old son of the commandant at a German concentration camp, whose forbidden friendship with a Jewish boy on the other side of the camp fence has startling and unexpected consequences.","Drama,War","Asa Butterfield, David Thewlis, Rupert Friend, Zac Mattoon O'Brien",Mark Herman,,2008,94
1508,Shooter,"A marksman living in exile is coaxed back into action after learning of a plot to kill the President. Ultimately double-crossed and framed for the attempt, he goes on the run to find the real killer and the reason he was set up.","Action,Crime,Drama","Mark Wahlberg, Michael Pea, Rhona Mitra, Danny Glover",Antoine Fuqua,,2007,124
1509,The Happening,"A science teacher, his wife, and a young girl struggle to survive a plague that causes those infected to commit suicide.","Sci-Fi,Thriller","Mark Wahlberg, Zooey Deschanel, John Leguizamo, Ashlyn Sanchez",M. Night Shyamalan,,2008,91
1510,Bone Tomahawk,Four men set out in the Wild West to rescue a group of captives from cannibalistic cave dwellers.,"Adventure,Drama,Horror","Kurt Russell, Patrick Wilson, Matthew Fox, Richard Jenkins",S. Craig Zahler,,2015,132
1511,Magic Mike XXL,"Three years after Mike bowed out of the stripper life at the top of his game, he and the remaining Kings of Tampa hit the road to Myrtle Beach to put on one last blow-out performance.","Comedy,Drama,Music","Channing Tatum, Joe Manganiello, Matt Bomer,Adam Rodriguez",Gregory Jacobs,,2015,115
1512,Easy A,A clean-cut high school student relies on the school's rumor mill to advance her social and financial standing.,"Comedy,Drama,Romance","Emma Stone, Amanda Bynes, Penn Badgley, Dan Byrd",Will Gluck,,2010,92
1513,Exodus: Gods and Kings,"The defiant leader Moses rises up against the Egyptian Pharaoh Ramses, setting 600,000 slaves on a monumental journey of escape from Egypt and its terrifying cycle of deadly plagues.","Action,Adventure,Drama","Christian Bale, Joel Edgerton, Ben Kingsley, Sigourney Weaver",Ridley Scott,,2014,150
1514,Chappie,"In the near future, crime is patrolled by a mechanized police force. When one police droid, Chappie, is stolen and given new programming, he becomes the first robot with the ability to think and feel for himself.","Action,Crime,Drama","Sharlto Copley, Dev Patel, Hugh Jackman,Sigourney Weaver",Neill Blomkamp,,2015,120
1515,The Hobbit: The Desolation of Smaug,"The dwarves, along with Bilbo Baggins and Gandalf the Grey, continue their quest to reclaim Erebor, their homeland, from Smaug. Bilbo Baggins is in possession of a mysterious and magical ring.","Adventure,Fantasy","Ian McKellen, Martin Freeman, Richard Armitage,Ken Stott",Peter Jackson,,2013,161
1516,Half of a Yellow Sun,"Sisters Olanna and Kainene return home to 1960s Nigeria, where they soon diverge on different paths. As civil war breaks out, political events loom larger than their differences as they join the fight to establish an independent republic.","Drama,Romance","Chiwetel Ejiofor, Thandie Newton, Anika Noni Rose,Joseph Mawle",Biyi Bandele,,2013,111
1517,Anthropoid,"Based on the extraordinary true story of Operation Anthropoid, the WWII mission to assassinate SS General Reinhard Heydrich, the main architect behind the Final Solution and the Reich's third in command after Hitler and Himmler.","Biography,History,Thriller","Jamie Dornan, Cillian Murphy, Brian Caspe, Karel Hermnek Jr.",Sean Ellis,,2016,120
1518,The Counselor,A lawyer finds himself in over his head when he gets involved in drug trafficking.,"Crime,Drama,Thriller","Michael Fassbender, Penlope Cruz, Cameron Diaz,Javier Bardem",Ridley Scott,,2013,117
1519,Viking,"Kievan Rus, late 10th century. After the death of his father, the young Viking prince Vladimir of Novgorod is forced into exile across the frozen sea.","Action,Drama,History","Anton Adasinsky, Aleksandr Armer, Vilen Babichev, Rostislav Bershauer",Andrey Kravchuk,,2016,133
1520,Whiskey Tango Foxtrot,A journalist recounts her wartime coverage in Afghanistan.,"Biography,Comedy,Drama","Tina Fey, Margot Robbie, Martin Freeman, Alfred Molina",Glenn Ficarra,,2016,112
1521,Trust,A teenage girl is targeted by an online sexual predator.,"Crime,Drama,Thriller","Clive Owen, Catherine Keener, Liana Liberato,Jason Clarke",David Schwimmer,,2010,106
1522,Birth of the Dragon,"Young, up-and-coming martial artist, Bruce Lee, challenges legendary kung fu master Wong Jack Man to a no-holds-barred fight in Northern California.","Action,Biography,Drama","Billy Magnussen, Terry Chen, Teresa Navarro,Vanessa Ross",George Nolfi,,2016,103
1523,Elysium,"In the year 2154, the very wealthy live on a man-made space station while the rest of the population resides on a ruined Earth. A man takes on a mission that could bring equality to the polarized worlds.","Action,Drama,Sci-Fi","Matt Damon, Jodie Foster, Sharlto Copley, Alice Braga",Neill Blomkamp,,2013,109
1524,The Green Inferno,"A group of student activists travels to the Amazon to save the rain forest and soon discover that they are not alone, and that no good deed goes unpunished.","Adventure,Horror","Lorenza Izzo, Ariel Levy, Aaron Burns, Kirby Bliss Blanton",Eli Roth,,2013,100
1525,Godzilla,"The world is beset by the appearance of monstrous creatures, but one of them may be the only one who can save humanity.","Action,Adventure,Sci-Fi","Aaron Taylor-Johnson, Elizabeth Olsen, Bryan Cranston, Ken Watanabe",Gareth Edwards,,2014,123
1526,The Bourne Legacy,"An expansion of the universe from Robert Ludlum's novels, centered on a new hero whose stakes have been triggered by the events of the previous three films.","Action,Adventure,Mystery","Jeremy Renner, Rachel Weisz, Edward Norton, Scott Glenn",Tony Gilroy,,2012,135
1527,A Good Year,"A British investment broker inherits his uncle's chateau and vineyard in Provence, where he spent much of his childhood. He discovers a new laid-back lifestyle as he tries to renovate the estate to be sold.","Comedy,Drama,Romance","Russell Crowe, Abbie Cornish, Albert Finney, Marion Cotillard",Ridley Scott,,2006,117
1528,Friend Request,"When a college student unfriends a mysterious girl online, she finds herself fighting a demonic presence that wants to make her lonely by killing her closest friends.","Horror,Thriller","Alycia Debnam-Carey, William Moseley, Connor Paolo, Brit Morgan",Simon Verhoeven,,2016,92
1529,Deja Vu,"After a ferry is bombed in New Orleans, an A.T.F. agent joins a unique investigation using experimental surveillance technology to find the bomber, but soon finds himself becoming obsessed with one of the victims.","Action,Sci-Fi,Thriller","Denzel Washington, Paula Patton, Jim Caviezel, Val Kilmer",Tony Scott,,2006,126
1530,Lucy,"A woman, accidentally caught in a dark deal, turns the tables on her captors and transforms into a merciless warrior evolved beyond human logic.","Action,Sci-Fi,Thriller","Scarlett Johansson, Morgan Freeman, Min-sik Choi,Amr Waked",Luc Besson,,2014,89
1531,A Quiet Passion,"The story of American poet Emily Dickinson from her early days as a young schoolgirl to her later years as a reclusive, unrecognized artist.","Biography,Drama","Cynthia Nixon, Jennifer Ehle, Duncan Duff, Keith Carradine",Terence Davies,,2016,125
1532,Need for Speed,"Fresh from prison, a street racer who was framed by a wealthy business associate joins a cross country race with revenge in mind. His ex-partner, learning of the plan, places a massive bounty on his head as the race begins.","Action,Crime,Drama","Aaron Paul, Dominic Cooper, Imogen Poots, Scott Mescudi",Scott Waugh,,2014,132
1533,Jack Reacher,A homicide investigator digs deeper into a case involving a trained military sniper who shot five random victims.,"Action,Crime,Mystery","Tom Cruise, Rosamund Pike, Richard Jenkins, Werner Herzog",Christopher McQuarrie,,2012,130
1534,The Do-Over,"Two down-on-their-luck guys decide to fake their own deaths and start over with new identities, only to find the people they're pretending to be are in even deeper trouble.","Action,Adventure,Comedy","Adam Sandler, David Spade, Paula Patton, Kathryn Hahn",Steven Brill,,2016,108
1535,True Crimes,"A murder investigation of a slain business man turns to clues found in an author's book about an eerily similar crime. Based on the 2008 article ""True Crimes - A postmodern murder mystery"" by David Grann.","Crime,Drama,Thriller","Jim Carrey, Charlotte Gainsbourg, Marton Csokas, Kati Outinen",Alexandros Avranas,,2016,92
1536,American Pastoral,An All-American college star and his beauty queen wife watch their seemingly perfect life fall apart as their daughter joins the turmoil of '60s America.,"Crime,Drama","Ewan McGregor, Jennifer Connelly, Dakota Fanning, Peter Riegert",Ewan McGregor,,2016,108
1537,The Ghost Writer,A ghostwriter hired to complete the memoirs of a former British prime minister uncovers secrets that put his own life in jeopardy.,"Mystery,Thriller","Ewan McGregor, Pierce Brosnan, Olivia Williams,Jon Bernthal",Roman Polanski,,2010,128
1538,Limitless,"With the help of a mysterious pill that enables the user to access 100 percent of his brain abilities, a struggling writer becomes a financial wizard, but it also puts him in a new world with lots of dangers.","Mystery,Sci-Fi,Thriller","Bradley Cooper, Anna Friel, Abbie Cornish, Robert De Niro",Neil Burger,,2011,105
1539,Spectral,A sci-fi/thriller story centered on a special-ops team that is dispatched to fight supernatural beings.,"Action,Mystery,Sci-Fi","James Badge Dale, Emily Mortimer, Bruce Greenwood,Max Martini",Nic Mathieu,,2016,107
1540,P.S. I Love You,A young widow discovers that her late husband has left her 10 messages intended to help ease her pain and start a new life.,"Drama,Romance","Hilary Swank, Gerard Butler, Harry Connick Jr., Lisa Kudrow",Richard LaGravenese,,2007,126
1541,Zipper,A successful family man with a blossoming political career loses all sense of morality when he becomes addicted to using an escort agency.,"Drama,Thriller","Patrick Wilson, Lena Headey, Ray Winstone,Richard Dreyfuss",Mora Stephens,,2015,103
1542,Midnight Special,"A father and son go on the run, pursued by the government and a cult drawn to the child's special powers.","Drama,Mystery,Sci-Fi","Michael Shannon, Joel Edgerton, Kirsten Dunst, Adam Driver",Jeff Nichols,,2016,112
1543,Don't Think Twice,"When a member of a popular New York City improv troupe gets a huge break, the rest of the group - all best friends - start to realize that not everyone is going to make it after all.","Comedy,Drama","Keegan-Michael Key, Gillian Jacobs, Mike Birbiglia,Chris Gethard",Mike Birbiglia,,2016,92
1544,Alice in Wonderland,"Nineteen-year-old Alice returns to the magical world from her childhood adventure, where she reunites with her old friends and learns of her true destiny: to end the Red Queen's reign of terror.","Adventure,Family,Fantasy","Mia Wasikowska, Johnny Depp, Helena Bonham Carter,Anne Hathaway",Tim Burton,,2010,108
1545,Chuck,A drama inspired by the life of heavyweight boxer Chuck Wepner.,"Biography,Drama,Sport","Elisabeth Moss, Naomi Watts, Ron Perlman, Liev Schreiber",Philippe Falardeau,,2016,98
1546,"I, Daniel Blake","After having suffered a heart-attack, a 59-year-old carpenter must fight the bureaucratic forces of the system in order to receive Employment and Support Allowance.",Drama,"Dave Johns, Hayley Squires, Sharon Percy, Briana Shann",Ken Loach,,2016,100
1547,The Break-Up,"In a bid to keep their luxurious condo from their significant other, a couple's break-up proceeds to get uglier and nastier by the moment.","Comedy,Drama,Romance","Jennifer Aniston, Vince Vaughn, Jon Favreau, Joey Lauren Adams",Peyton Reed,,2006,106
1548,Loving,"The story of Richard and Mildred Loving, a couple whose arrest for interracial marriage in 1960s Virginia began a legal battle that would end with the Supreme Court's historic 1967 decision.","Biography,Drama,Romance","Ruth Negga, Joel Edgerton, Will Dalton, Dean Mumford",Jeff Nichols,,2016,123
1549,Fantastic Four,Four young outsiders teleport to an alternate and dangerous universe which alters their physical form in shocking ways. The four must learn to harness their new abilities and work together to save Earth from a former friend turned enemy.,"Action,Adventure,Sci-Fi","Miles Teller, Kate Mara, Michael B. Jordan, Jamie Bell",Josh Trank,,2015,100
1550,The Survivalist,"In a time of starvation, a survivalist lives off a small plot of land hidden deep in forest. When two women seeking food and shelter discover his farm, he finds his existence threatened.","Drama,Sci-Fi,Thriller","Mia Goth, Martin McCann, Barry Ward, Andrew Simpson",Stephen Fingleton,,2015,104
1551,Colonia,"A young woman's desperate search for her abducted boyfriend that draws her into the infamous Colonia Dignidad, a sect nobody has ever escaped from.","Drama,Romance,Thriller","Emma Watson, Daniel Brhl, Michael Nyqvist,Richenda Carey",Florian Gallenberger,,2015,106
1552,The Boy Next Door,"A woman, separated from her unfaithful husband, falls for a younger man who has moved in next door, but their torrid affair soon takes a dangerous turn.","Mystery,Thriller","Jennifer Lopez, Ryan Guzman, Kristin Chenoweth, John Corbett",Rob Cohen,,2015,91
1553,The Gift,A young married couple's lives are thrown into a harrowing tailspin when an acquaintance from the husband's past brings mysterious gifts and a horrifying secret to light after more than 20 years.,"Mystery,Thriller","Jason Bateman, Rebecca Hall, Joel Edgerton, Allison Tolman",Joel Edgerton,,2015,108
1554,Dracula Untold,"As his kingdom is being threatened by the Turks, young prince Vlad Tepes must become a monster feared by his own people in order to obtain the power needed to protect his own family, and the families of his kingdom.","Action,Drama,Fantasy","Luke Evans, Dominic Cooper, Sarah Gadon, Art Parkinson",Gary Shore,,2014,92
1555,In the Heart of the Sea,"A recounting of a New England whaling ship's sinking by a giant whale in 1820, an experience that later inspired the great novel Moby-Dick.","Action,Adventure,Biography","Chris Hemsworth, Cillian Murphy, Brendan Gleeson,Ben Whishaw",Ron Howard,,2015,122
1556,Idiocracy,"Private Joe Bauers, the definition of ""average American"", is selected by the Pentagon to be the guinea pig for a top-secret hibernation program. Forgotten, he awakes five centuries in the future. He discovers a society so incredibly dumbed down that he's easily the most intelligent person alive.","Adventure,Comedy,Sci-Fi","Luke Wilson, Maya Rudolph, Dax Shepard, Terry Crews",Mike Judge,,2006,84
1557,The Expendables,A CIA operative hires a team of mercenaries to eliminate a Latin dictator and a renegade CIA agent.,"Action,Adventure,Thriller","Sylvester Stallone, Jason Statham, Jet Li, Dolph Lundgren",Sylvester Stallone,,2010,103
1558,Evil Dead,"Five friends head to a remote cabin, where the discovery of a Book of the Dead leads them to unwittingly summon up demons living in the nearby woods.","Fantasy,Horror","Jane Levy, Shiloh Fernandez, Jessica Lucas, Lou Taylor Pucci",Fede Alvarez,,2013,91
1559,Sinister,Washed-up true-crime writer Ellison Oswalt finds a box of super 8 home movies that suggest the murder he is currently researching is the work of a serial killer whose work dates back to the 1960s.,"Horror,Mystery","Ethan Hawke, Juliet Rylance, James Ransone,Fred Dalton Thompson",Scott Derrickson,,2012,110
1560,Wreck-It Ralph,"A video game villain wants to be a hero and sets out to fulfill his dream, but his quest brings havoc to the whole arcade where he lives.","Animation,Adventure,Comedy","John C. Reilly, Jack McBrayer, Jane Lynch, Sarah Silverman",Rich Moore,,2012,101
1561,Snow White and the Huntsman,"In a twist to the fairy tale, the Huntsman ordered to take Snow White into the woods to be killed winds up becoming her protector and mentor in a quest to vanquish the Evil Queen.","Action,Adventure,Drama","Kristen Stewart, Chris Hemsworth, Charlize Theron, Sam Claflin",Rupert Sanders,,2012,127
1562,Pan,"12-year-old orphan Peter is spirited away to the magical world of Neverland, where he finds both fun and danger, and ultimately discovers his destiny -- to become the hero who will be forever known as Peter Pan.","Adventure,Family,Fantasy","Levi Miller, Hugh Jackman, Garrett Hedlund, Rooney Mara",Joe Wright,,2015,111
1563,Transformers: Dark of the Moon,"The Autobots learn of a Cybertronian spacecraft hidden on the moon, and race against the Decepticons to reach it and to learn its secrets.","Action,Adventure,Sci-Fi","Shia LaBeouf, Rosie Huntington-Whiteley, Tyrese Gibson, Josh Duhamel",Michael Bay,,2011,154
1564,Juno,"Faced with an unplanned pregnancy, an offbeat young woman makes an unusual decision regarding her unborn child.","Comedy,Drama","Ellen Page, Michael Cera, Jennifer Garner, Jason Bateman",Jason Reitman,,2007,96
1565,A Hologram for the King,A failed American sales rep looks to recoup his losses by traveling to Saudi Arabia and selling his company's product to a wealthy monarch.,"Comedy,Drama","Tom Hanks, Sarita Choudhury, Ben Whishaw,Alexander Black",Tom Tykwer,,2016,98
1566,Money Monster,Financial TV host Lee Gates and his producer Patty are put in an extreme situation when an irate investor takes over their studio.,"Crime,Drama,Thriller","George Clooney, Julia Roberts, Jack O'Connell,Dominic West",Jodie Foster,,2016,98
1567,The Other Woman,"After discovering her boyfriend is married, Carly soon meets the wife he's been betraying. And when yet another love affair is discovered, all three women team up to plot revenge on the three-timing S.O.B.","Comedy,Romance","Cameron Diaz, Leslie Mann, Kate Upton, Nikolaj Coster-Waldau",Nick Cassavetes,,2014,109
1568,Enchanted,"A young maiden in a land called Andalasia, who is prepared to be wed, is sent away to New York City by an evil queen, where she falls in love with a lawyer.","Animation,Comedy,Family","Amy Adams, Susan Sarandon, James Marsden, Patrick Dempsey",Kevin Lima,,2007,107
1569,The Intern,"70-year-old widower Ben Whittaker has discovered that retirement isn't all it's cracked up to be. Seizing an opportunity to get back in the game, he becomes a senior intern at an online fashion site, founded and run by Jules Ostin.","Comedy,Drama","Robert De Niro, Anne Hathaway, Rene Russo,Anders Holm",Nancy Meyers,,2015,121
1570,Little Miss Sunshine,A family determined to get their young daughter into the finals of a beauty pageant take a cross-country trip in their VW bus.,"Comedy,Drama","Steve Carell, Toni Collette, Greg Kinnear, Abigail Breslin",Jonathan Dayton,,2006,101
1571,Bleed for This,"The inspirational story of World Champion Boxer Vinny Pazienza who, after a near fatal car crash which left him not knowing if he'd ever walk again, made one of sport's most incredible comebacks.","Biography,Drama,Sport","Miles Teller, Aaron Eckhart, Katey Sagal, Ciarn Hinds",Ben Younger,,2016,117
1572,Clash of the Titans,"Perseus demigod, son of Zeus, battles the minions of the underworld to stop them from conquering heaven and earth.","Action,Adventure,Fantasy","Sam Worthington, Liam Neeson, Ralph Fiennes,Jason Flemyng",Louis Leterrier,,2010,106
1573,The Finest Hours,The Coast Guard makes a daring rescue attempt off the coast of Cape Cod after a pair of oil tankers are destroyed during a blizzard in 1952.,"Action,Drama,History","Chris Pine, Casey Affleck, Ben Foster, Eric Bana",Craig Gillespie,,2016,117
1574,Tron,The son of a virtual world designer goes looking for his father and ends up inside the digital world that his father designed. He meets his father's corrupted creation and a unique ally who was born inside the digital world.,"Action,Adventure,Sci-Fi","Jeff Bridges, Garrett Hedlund, Olivia Wilde, Bruce Boxleitner",Joseph Kosinski,,2010,125
1575,The Hunger Games: Catching Fire,Katniss Everdeen and Peeta Mellark become targets of the Capitol after their victory in the 74th Hunger Games sparks a rebellion in the Districts of Panem.,"Action,Adventure,Mystery","Jennifer Lawrence, Josh Hutcherson, Liam Hemsworth, Philip Seymour Hoffman",Francis Lawrence,,2013,146
1576,All Good Things,"Mr. David Marks was suspected but never tried for killing his wife Katie who disappeared in 1982, but the truth is eventually revealed.","Crime,Drama,Mystery","Ryan Gosling, Kirsten Dunst, Frank Langella, Lily Rabe",Andrew Jarecki,,2010,101
1577,Kickboxer: Vengeance,A kick boxer is out to avenge his brother.,Action,"Dave Bautista, Alain Moussi, Gina Carano, Jean-Claude Van Damme",John Stockwell,,2016,90
1578,The Last Airbender,"Follows the adventures of Aang, a young successor to a long line of Avatars, who must master all four elements and stop the Fire Nation from enslaving the Water Tribes and the Earth Kingdom.","Action,Adventure,Family","Noah Ringer, Nicola Peltz, Jackson Rathbone,Dev Patel",M. Night Shyamalan,,2010,103
1579,Sex Tape,"A married couple wake up to discover that the sex tape they made the evening before has gone missing, leading to a frantic search for its whereabouts.","Comedy,Romance","Jason Segel, Cameron Diaz, Rob Corddry, Ellie Kemper",Jake Kasdan,,2014,94
1580,What to Expect When You're Expecting,"Follows the lives of five interconnected couples as they experience the thrills and surprises of having a baby, and realize that no matter what you plan for, life does not always deliver what is expected.","Comedy,Drama,Romance","Cameron Diaz, Matthew Morrison, J. Todd Smith, Dennis Quaid",Kirk Jones,,2012,110
1581,Moneyball,Oakland A's general manager Billy Beane's successful attempt to assemble a baseball team on a lean budget by employing computer-generated analysis to acquire new players.,"Biography,Drama,Sport","Brad Pitt, Robin Wright, Jonah Hill, Philip Seymour Hoffman",Bennett Miller,,2011,133
1582,Ghost Rider,"Stunt motorcyclist Johnny Blaze gives up his soul to become a hellblazing vigilante, to fight against power hungry Blackheart, the son of the devil himself.","Action,Fantasy,Thriller","Nicolas Cage, Eva Mendes, Sam Elliott, Matt Long",Mark Steven Johnson,,2007,114
1583,Unbroken,"After a near-fatal plane crash in WWII, Olympian Louis Zamperini spends a harrowing 47 days in a raft with two fellow crewmen before he's caught by the Japanese navy and sent to a prisoner-of-war camp.","Biography,Drama,Sport","Jack O'Connell, Miyavi, Domhnall Gleeson, Garrett Hedlund",Angelina Jolie,,2014,137
1584,Immortals,"Theseus is a mortal man chosen by Zeus to lead the fight against the ruthless King Hyperion, who is on a rampage across Greece to obtain a weapon that can destroy humanity.","Action,Drama,Fantasy","Henry Cavill, Mickey Rourke, John Hurt, Stephen Dorff",Tarsem Singh,,2011,110
1585,Sunshine,A team of international astronauts are sent on a dangerous mission to reignite the dying Sun with a nuclear fission bomb in 2057.,"Adventure,Sci-Fi,Thriller","Cillian Murphy, Rose Byrne, Chris Evans, Michelle Yeoh",Danny Boyle,,2007,107
1586,Brave,"Determined to make her own path in life, Princess Merida defies a custom that brings chaos to her kingdom. Granted one wish, Merida must rely on her bravery and her archery skills to undo a beastly curse.","Animation,Adventure,Comedy","Kelly Macdonald,Billy Connolly, Emma Thompson, Julie Walters",Mark Andrews,,2012,93
1587,Mn som hatar kvinnor,A journalist is aided in his search for a woman who has been missing -- or dead -- for forty years by a young female hacker.,"Drama,Mystery,Thriller","Michael Nyqvist, Noomi Rapace, Ewa Frling,Lena Endre",Niels Arden Oplev,,2009,152
1588,Adoration,A pair of childhood friends and neighbors fall for each other's sons.,"Drama,Romance","Naomi Watts, Robin Wright, Xavier Samuel, James Frecheville",Anne Fontaine,,2013,112
1589,The Drop,"Bob Saginowski finds himself at the center of a robbery gone awry and entwined in an investigation that digs deep into the neighborhood's past where friends, families, and foes all work together to make a living - no matter the cost.","Crime,Drama,Mystery","Tom Hardy, Noomi Rapace, James Gandolfini,Matthias Schoenaerts",Michal R. Roskam,,2014,106
