,Title,Description,Genre,Actors,Director,rating,Year,Runtime (Minutes)
1066,Deepwater Horizon,"A dramatization of the April 2010 disaster, when the offshore drilling rig Deepwater Horizon exploded and created the worst oil spill in U.S. history.","Action,Drama,Thriller","Mark Wahlberg, Kurt Russell, Douglas M. Griffin, James DuMont",Peter Berg,,2016,107
1067,The Promise,"Set during the last days of the Ottoman Empire, The Promise follows a love triangle between Michael, a brilliant medical student, the beautiful and sophisticated Ana, and Chris - a renowned American journalist based in Paris.","Drama,History","Oscar Isaac, Charlotte Le Bon, Christian Bale, Daniel Gimnez Cacho",Terry George,,2016,133
1068,Allied,"In 1942, a Canadian intelligence officer in North Africa encounters a female French Resistance fighter on a deadly mission behind enemy lines. When they reunite in London, their relationship is tested by the pressures of war.","Action,Drama,Romance","Brad Pitt, Marion Cotillard, Jared Harris, Vincent Ebrahim",Robert Zemeckis,,2016,124
1069,A Monster Calls,A boy seeks the help of a tree monster to cope with his single mother's terminal illness.,"Drama,Fantasy","Lewis MacDougall, Sigourney Weaver, Felicity Jones,Toby Kebbell",J.A. Bayona,,2016,108
1070,Collateral Beauty,"Retreating from life after a tragedy, a man questions the universe by writing to Love, Time and Death. Receiving unexpected answers, he begins to see how these things interlock and how even loss can reveal moments of meaning and beauty.","Drama,Romance","Will Smith, Edward Norton, Kate Winslet, Michael Pea",David Frankel,,2016,97
1071,Zootopia,"In a city of anthropomorphic animals, a rookie bunny cop and a cynical con artist fox must work together to uncover a conspiracy.","Animation,Adventure,Comedy","Ginnifer Goodwin, Jason Bateman, Idris Elba, Jenny Slate",Byron Howard,,2016,108
1072,Pirates of the Caribbean: At World's End,"Captain Barbossa, Will Turner and Elizabeth Swann must sail off the edge of the map, navigate treachery and betrayal, find Jack Sparrow, and make their final alliances for one last decisive battle.","Action,Adventure,Fantasy","Johnny Depp, Orlando Bloom, Keira Knightley,Geoffrey Rush",Gore Verbinski,,2007,169
1073,The Avengers,Earth's mightiest heroes must come together and learn to fight as a team if they are to stop the mischievous Loki and his alien army from enslaving humanity.,"Action,Sci-Fi","Robert Downey Jr., Chris Evans, Scarlett Johansson,Jeremy Renner",Joss Whedon,,2012,143
1074,Inglourious Basterds,"In Nazi-occupied France during World War II, a plan to assassinate Nazi leaders by a group of Jewish U.S. soldiers coincides with a theatre owner's vengeful plans for the same.","Adventure,Drama,War","Brad Pitt, Diane Kruger, Eli Roth,Mlanie Laurent",Quentin Tarantino,,2009,153
1075,Pirates of the Caribbean: Dead Man's Chest,"Jack Sparrow races to recover the heart of Davy Jones to avoid enslaving his soul to Jones' service, as other friends and foes seek the heart for their own agenda as well.","Action,Adventure,Fantasy","Johnny Depp, Orlando Bloom, Keira Knightley, Jack Davenport",Gore Verbinski,,2006,151
1076,Ghostbusters,"Following a ghost invasion of Manhattan, paranormal enthusiasts Erin Gilbert and Abby Yates, nuclear engineer Jillian Holtzmann, and subway worker Patty Tolan band together to stop the otherworldly threat.","Action,Comedy,Fantasy","Melissa McCarthy, Kristen Wiig, Kate McKinnon, Leslie Jones",Paul Feig,,2016,116
1077,Inception,"A thief, who steals corporate secrets through use of dream-sharing technology, is given the inverse task of planting an idea into the mind of a CEO.","Action,Adventure,Sci-Fi","Leonardo DiCaprio, Joseph Gordon-Levitt, Ellen Page, Ken Watanabe",Christopher Nolan,,2010,148
1078,Captain Fantastic,"In the forests of the Pacific Northwest, a father devoted to raising his six kids with a rigorous physical and intellectual education is forced to leave his paradise and enter the world, challenging his idea of what it means to be a parent.","Comedy,Drama","Viggo Mortensen, George MacKay, Samantha Isler,Annalise Basso",Matt Ross,,2016,118
1079,The Wolf of Wall Street,"Based on the true story of Jordan Belfort, from his rise to a wealthy stock-broker living the high life to his fall involving crime, corruption and the federal government.","Biography,Comedy,Crime","Leonardo DiCaprio, Jonah Hill, Margot Robbie,Matthew McConaughey",Martin Scorsese,,2013,180
1080,Gone Girl,"With his wife's disappearance having become the focus of an intense media circus, a man sees the spotlight turned on him when it's suspected that he may not be innocent.","Crime,Drama,Mystery","Ben Affleck, Rosamund Pike, Neil Patrick Harris,Tyler Perry",David Fincher,,2014,149
1081,Furious Seven,Deckard Shaw seeks revenge against Dominic Toretto and his family for his comatose brother.,"Action,Crime,Thriller","Vin Diesel, Paul Walker, Dwayne Johnson, Jason Statham",James Wan,,2015,137
1082,Jurassic World,"A new theme park, built on the original site of Jurassic Park, creates a genetically modified hybrid dinosaur, which escapes containment and goes on a killing spree.","Action,Adventure,Sci-Fi","Chris Pratt, Bryce Dallas Howard, Ty Simpkins,Judy Greer",Colin Trevorrow,,2015,124
1083,Live by Night,"A group of Boston-bred gangsters set up shop in balmy Florida during the Prohibition era, facing off against the competition and the Ku Klux Klan.","Crime,Drama","Ben Affleck, Elle Fanning, Brendan Gleeson, Chris Messina",Ben Affleck,,2016,129
1084,Avatar,A paraplegic marine dispatched to the moon Pandora on a unique mission becomes torn between following his orders and protecting the world he feels is his home.,"Action,Adventure,Fantasy","Sam Worthington, Zoe Saldana, Sigourney Weaver, Michelle Rodriguez",James Cameron,,2009,162
1085,The Hateful Eight,"In the dead of a Wyoming winter, a bounty hunter and his prisoner find shelter in a cabin currently inhabited by a collection of nefarious characters.","Crime,Drama,Mystery","Samuel L. Jackson, Kurt Russell, Jennifer Jason Leigh, Walton Goggins",Quentin Tarantino,,2015,187
1086,The Accountant,"As a math savant uncooks the books for a new client, the Treasury Department closes in on his activities and the body count starts to rise.","Action,Crime,Drama","Ben Affleck, Anna Kendrick, J.K. Simmons, Jon Bernthal",Gavin O'Connor,,2016,128
1087,Prisoners,"When Keller Dover's daughter and her friend go missing, he takes matters into his own hands as the police pursue multiple leads and the pressure mounts.","Crime,Drama,Mystery","Hugh Jackman, Jake Gyllenhaal, Viola Davis,Melissa Leo",Denis Villeneuve,,2013,153
1088,Warcraft,"As an Orc horde invades the planet Azeroth using a magic portal, a few human heroes and dissenting Orcs must attempt to stop the true evil behind this war.","Action,Adventure,Fantasy","Travis Fimmel, Paula Patton, Ben Foster, Dominic Cooper",Duncan Jones,,2016,123
1089,The Help,"An aspiring author during the civil rights movement of the 1960s decides to write a book detailing the African American maids' point of view on the white families for which they work, and the hardships they go through on a daily basis.",Drama,"Emma Stone, Viola Davis, Octavia Spencer, Bryce Dallas Howard",Tate Taylor,,2011,146
1090,War Dogs,"Based on the true story of two young men, David Packouz and Efraim Diveroli, who won a $300 million contract from the Pentagon to arm America's allies in Afghanistan.","Comedy,Crime,Drama","Jonah Hill, Miles Teller, Steve Lantz, Gregg Weiner",Todd Phillips,,2016,114
1091,Avengers: Age of Ultron,"When Tony Stark and Bruce Banner try to jump-start a dormant peacekeeping program called Ultron, things go horribly wrong and it's up to Earth's mightiest heroes to stop the villainous Ultron from enacting his terrible plan.","Action,Adventure,Sci-Fi","Robert Downey Jr., Chris Evans, Mark Ruffalo, Chris Hemsworth",Joss Whedon,,2015,141
1092,The Nice Guys,"In 1970s Los Angeles, a mismatched pair of private eyes investigate a missing girl and the mysterious death of a porn star.","Action,Comedy,Crime","Russell Crowe, Ryan Gosling, Angourie Rice, Matt Bomer",Shane Black,,2016,116
1093,Kimi no na wa,"Two strangers find themselves linked in a bizarre way. When a connection forms, will distance be the only thing to keep them apart?","Animation,Drama,Fantasy","Rynosuke Kamiki, Mone Kamishiraishi, Ry Narita, Aoi Yuki",Makoto Shinkai,,2016,106
1094,The Void,"Shortly after delivering a patient to an understaffed hospital, a police officer experiences strange and violent occurrences seemingly linked to a group of mysterious hooded figures.","Horror,Mystery,Sci-Fi","Aaron Poole, Kenneth Welsh,Daniel Fathers, Kathleen Munroe",Jeremy Gillespie,,2016,90
1095,Personal Shopper,A personal shopper in Paris refuses to leave the city until she makes contact with her twin brother who previously died there. Her life becomes more complicated when a mysterious person contacts her via text message.,"Drama,Mystery,Thriller","Kristen Stewart, Lars Eidinger, Sigrid Bouaziz,Anders Danielsen Lie",Olivier Assayas,,2016,105
1096,The Departed,An undercover cop and a mole in the police attempt to identify each other while infiltrating an Irish gang in South Boston.,"Crime,Drama,Thriller","Leonardo DiCaprio, Matt Damon, Jack Nicholson, Mark Wahlberg",Martin Scorsese,,2006,151
1097,Legend,Identical twin gangsters Ronald and Reginald Kray terrorize London during the 1960s.,"Biography,Crime,Drama","Tom Hardy, Emily Browning, Taron Egerton, Paul Anderson",Brian Helgeland,,2015,132
1098,Thor,"The powerful but arrogant god Thor is cast out of Asgard to live amongst humans in Midgard (Earth), where he soon becomes one of their finest defenders.","Action,Adventure,Fantasy","Chris Hemsworth, Anthony Hopkins, Natalie Portman, Tom Hiddleston",Kenneth Branagh,,2011,115
1099,The Martian,"An astronaut becomes stranded on Mars after his team assume him dead, and must rely on his ingenuity to find a way to signal to Earth that he is alive.","Adventure,Drama,Sci-Fi","Matt Damon, Jessica Chastain, Kristen Wiig, Kate Mara",Ridley Scott,,2015,144
1100,Contratiempo,A young businessman faces a lawyer trying to prove his innocence by the assassination of his lover.,"Crime,Mystery,Thriller","Mario Casas, Ana Wagener, Jos Coronado, Brbara Lennie",Oriol Paulo,,2016,106
1101,The Man from U.N.C.L.E.,"In the early 1960s, CIA agent Napoleon Solo and KGB operative Illya Kuryakin participate in a joint mission against a mysterious criminal organization, which is working to proliferate nuclear weapons.","Action,Adventure,Comedy","Henry Cavill, Armie Hammer, Alicia Vikander, Elizabeth Debicki",Guy Ritchie,,2015,116
1102,Hell or High Water,A divorced father and his ex-con older brother resort to a desperate scheme in order to save their family's ranch in West Texas.,"Crime,Drama,Thriller","Chris Pine, Ben Foster, Jeff Bridges, Gil Birmingham",David Mackenzie,,2016,102
1103,The Comedian,A look at the life of an aging insult comic named Jack Burke.,Comedy,"Robert De Niro, Leslie Mann, Danny DeVito, Edie Falco",Taylor Hackford,,2016,120
1104,The Legend of Tarzan,"Tarzan, having acclimated to life in London, is called back to his former home in the jungle to investigate the activities at a mining encampment.","Action,Adventure,Drama","Alexander Skarsgrd, Rory J. Saper, Christian Stevens, Christoph Waltz",David Yates,,2016,110
1105,All We Had,A mother struggles to make a better life for her daughter.,Drama,"Eve Lindley, Richard Kind, Mark Consuelos, Katherine Reis",Katie Holmes,,2016,105
1106,Ex Machina,A young programmer is selected to participate in a ground-breaking experiment in synthetic intelligence by evaluating the human qualities of a breath-taking humanoid A.I.,"Drama,Mystery,Sci-Fi","Alicia Vikander, Domhnall Gleeson, Oscar Isaac,Sonoya Mizuno",Alex Garland,,2014,108
1107,The Belko Experiment,"In a twisted social experiment, 80 Americans are locked in their high-rise corporate office in Bogot, Colombia and ordered by an unknown voice coming from the company's intercom system to participate in a deadly game of kill or be killed.","Action,Horror,Thriller","John Gallagher Jr., Tony Goldwyn, Adria Arjona, John C. McGinley",Greg McLean,,2016,89
1108,12 Years a Slave,"In the antebellum United States, Solomon Northup, a free black man from upstate New York, is abducted and sold into slavery.","Biography,Drama,History","Chiwetel Ejiofor, Michael Kenneth Williams, Michael Fassbender, Brad Pitt",Steve McQueen,,2013,134
1109,The Bad Batch,A dystopian love story in a Texas wasteland and set in a community of cannibals.,"Romance,Sci-Fi","Keanu Reeves, Jason Momoa, Jim Carrey, Diego Luna",Ana Lily Amirpour,,2016,118
1110,300,King Leonidas of Sparta and a force of 300 men fight the Persians at Thermopylae in 480 B.C.,"Action,Fantasy,War","Gerard Butler, Lena Headey, David Wenham, Dominic West",Zack Snyder,,2006,117
1111,Harry Potter and the Deathly Hallows: Part 2,"Harry, Ron and Hermione search for Voldemort's remaining Horcruxes in their effort to destroy the Dark Lord as the final battle rages on at Hogwarts.","Adventure,Drama,Fantasy","Daniel Radcliffe, Emma Watson, Rupert Grint, Michael Gambon",David Yates,,2011,130
1112,Office Christmas Party,"When his uptight CEO sister threatens to shut down his branch, the branch manager throws an epic Christmas party in order to land a big client and save the day, but the party gets way out of hand...",Comedy,"Jason Bateman, Olivia Munn, T.J. Miller,Jennifer Aniston",Josh Gordon,,2016,105
1113,The Neon Demon,"When aspiring model Jesse moves to Los Angeles, her youth and vitality are devoured by a group of beauty-obsessed women who will take any means necessary to get what she has.","Horror,Thriller","Elle Fanning, Christina Hendricks, Keanu Reeves, Karl Glusman",Nicolas Winding Refn,,2016,118
1114,Dangal,Former wrestler Mahavir Singh Phogat and his two wrestler daughters struggle towards glory at the Commonwealth Games in the face of societal oppression.,"Action,Biography,Drama","Aamir Khan, Sakshi Tanwar, Fatima Sana Shaikh,Sanya Malhotra",Nitesh Tiwari,,2016,161
1115,10 Cloverfield Lane,"After getting in a car accident, a woman is held in a shelter with two men, who claim the outside world is affected by a widespread chemical attack.","Drama,Horror,Mystery","John Goodman, Mary Elizabeth Winstead, John Gallagher Jr., Douglas M. Griffin",Dan Trachtenberg,,2016,104
1116,Finding Dory,"The friendly but forgetful blue tang fish, Dory, begins a search for her long-lost parents, and everyone learns a few things about the real meaning of family along the way.","Animation,Adventure,Comedy","Ellen DeGeneres, Albert Brooks,Ed O'Neill, Kaitlin Olson",Andrew Stanton,,2016,97
1117,Miss Peregrine's Home for Peculiar Children,"When Jacob discovers clues to a mystery that stretches across time, he finds Miss Peregrine's Home for Peculiar Children. But the danger deepens after he gets to know the residents and learns about their special powers.","Adventure,Drama,Family","Eva Green, Asa Butterfield, Samuel L. Jackson, Judi Dench",Tim Burton,,2016,127
1118,Divergent,"In a world divided by factions based on virtues, Tris learns she's Divergent and won't fit in. When she discovers a plot to destroy Divergents, Tris and the mysterious Four must find out what makes Divergents dangerous before it's too late.","Adventure,Mystery,Sci-Fi","Shailene Woodley, Theo James, Kate Winslet, Jai Courtney",Neil Burger,,2014,139
1119,Mike and Dave Need Wedding Dates,"Two hard-partying brothers place an online ad to find the perfect dates for their sister's Hawaiian wedding. Hoping for a wild getaway, the boys instead find themselves out-hustled by an uncontrollable duo.","Adventure,Comedy,Romance","Zac Efron, Adam Devine, Anna Kendrick, Aubrey Plaza",Jake Szymanski,,2016,98
1120,Boyka: Undisputed IV,"In the fourth installment of the fighting franchise, Boyka is shooting for the big leagues when an accidental death in the ring makes him question everything he stands for.",Action,"Scott Adkins, Teodora Duhovnikova, Alon Aboutboul, Julian Vergov",Todor Chapkanov,,2016,86
1121,The Dark Knight Rises,"Eight years after the Joker's reign of anarchy, the Dark Knight, with the help of the enigmatic Selina, is forced from his imposed exile to save Gotham City, now on the edge of total annihilation, from the brutal guerrilla terrorist Bane.","Action,Thriller","Christian Bale, Tom Hardy, Anne Hathaway,Gary Oldman",Christopher Nolan,,2012,164
1122,The Jungle Book,"After a threat from the tiger Shere Khan forces him to flee the jungle, a man-cub named Mowgli embarks on a journey of self discovery with the help of panther, Bagheera, and free spirited bear, Baloo.","Adventure,Drama,Family","Neel Sethi, Bill Murray, Ben Kingsley, Idris Elba",Jon Favreau,,2016,106
1123,Transformers: Age of Extinction,"Autobots must escape sight from a bounty hunter who has taken control of the human serendipity: Unexpectedly, Optimus Prime and his remaining gang turn to a mechanic, his daughter, and her back street racing boyfriend for help.","Action,Adventure,Sci-Fi","Mark Wahlberg, Nicola Peltz, Jack Reynor, Stanley Tucci",Michael Bay,,2014,165
1124,Nerve,"A high school senior finds herself immersed in an online game of truth or dare, where her every move starts to become manipulated by an anonymous community of ""watchers.""","Adventure,Crime,Mystery","Emma Roberts, Dave Franco, Emily Meade, Miles Heizer",Henry Joost,,2016,96
1125,Mamma Mia!,The story of a bride-to-be trying to find her real father told using hit songs by the popular '70s group ABBA.,"Comedy,Family,Musical","Meryl Streep, Pierce Brosnan, Amanda Seyfried,Stellan Skarsgrd",Phyllida Lloyd,,2008,108
1126,The Revenant,A frontiersman on a fur trading expedition in the 1820s fights for survival after being mauled by a bear and left for dead by members of his own hunting team.,"Adventure,Drama,Thriller","Leonardo DiCaprio, Tom Hardy, Will Poulter, Domhnall Gleeson",Alejandro Gonzlez Irritu,,2015,156
1127,Fences,"A working-class African-American father tries to raise his family in the 1950s, while coming to terms with the events of his life.",Drama,"Denzel Washington, Viola Davis, Stephen Henderson, Jovan Adepo",Denzel Washington,,2016,139
1128,Into the Woods,A witch tasks a childless baker and his wife with procuring magical items from classic fairy tales to reverse the curse put on their family tree.,"Adventure,Comedy,Drama","Anna Kendrick, Meryl Streep, Chris Pine, Emily Blunt",Rob Marshall,,2014,125
1129,The Shallows,"A mere 200 yards from shore, surfer Nancy is attacked by a great white shark, with her short journey to safety becoming the ultimate contest of wills.","Drama,Horror,Thriller","Blake Lively, scar Jaenada, Angelo Josue Lozano Corzo, Brett Cullen",Jaume Collet-Serra,,2016,86
1130,Whiplash,A promising young drummer enrolls at a cut-throat music conservatory where his dreams of greatness are mentored by an instructor who will stop at nothing to realize a student's potential.,"Drama,Music","Miles Teller, J.K. Simmons, Melissa Benoist, Paul Reiser",Damien Chazelle,,2014,107
1131,Furious 6,"Hobbs has Dominic and Brian reassemble their crew to take down a team of mercenaries: Dominic unexpectedly gets convoluted also facing his presumed deceased girlfriend, Letty.","Action,Crime,Thriller","Vin Diesel, Paul Walker, Dwayne Johnson, Michelle Rodriguez",Justin Lin,,2013,130
1132,The Place Beyond the Pines,"A motorcycle stunt rider turns to robbing banks as a way to provide for his lover and their newborn child, a decision that puts him on a collision course with an ambitious rookie cop navigating a department ruled by a corrupt detective.","Crime,Drama,Thriller","Ryan Gosling, Bradley Cooper, Eva Mendes,Craig Van Hook",Derek Cianfrance,,2012,140
1133,No Country for Old Men,Violence and mayhem ensue after a hunter stumbles upon a drug deal gone wrong and more than two million dollars in cash near the Rio Grande.,"Crime,Drama,Thriller","Tommy Lee Jones, Javier Bardem, Josh Brolin, Woody Harrelson",Ethan Coen,,2007,122
1134,The Great Gatsby,"A writer and wall street trader, Nick, finds himself drawn to the past and lifestyle of his millionaire neighbor, Jay Gatsby.","Drama,Romance","Leonardo DiCaprio, Carey Mulligan, Joel Edgerton,Tobey Maguire",Baz Luhrmann,,2013,143
1135,Shutter Island,"In 1954, a U.S. marshal investigates the disappearance of a murderess who escaped from a hospital for the criminally insane.","Mystery,Thriller","Leonardo DiCaprio, Emily Mortimer, Mark Ruffalo,Ben Kingsley",Martin Scorsese,,2010,138
1136,Brimstone,"From the moment the new reverend climbs the pulpit, Liz knows she and her family are in great danger.","Mystery,Thriller,Western","Dakota Fanning, Guy Pearce, Kit Harington,Carice van Houten",Martin Koolhoven,,2016,148
1137,Star Trek,The brash James T. Kirk tries to live up to his father's legacy with Mr. Spock keeping him in check as a vengeful Romulan from the future creates black holes to destroy the Federation one planet at a time.,"Action,Adventure,Sci-Fi","Chris Pine, Zachary Quinto, Simon Pegg, Leonard Nimoy",J.J. Abrams,,2009,127
1138,Diary of a Wimpy Kid,"The adventures of a teenager who is fresh out of elementary and transitions to middle school, where he has to learn the consequences and responsibility to survive the year.","Comedy,Family","Zachary Gordon, Robert Capron, Rachael Harris,Steve Zahn",Thor Freudenthal,,2010,94
1139,The Big Short,"Four denizens in the world of high-finance predict the credit and housing bubble collapse of the mid-2000s, and decide to take on the big banks for their greed and lack of foresight.","Biography,Comedy,Drama","Christian Bale, Steve Carell, Ryan Gosling, Brad Pitt",Adam McKay,,2015,130
1140,Room,A young boy is raised within the confines of a small shed.,Drama,"Brie Larson, Jacob Tremblay, Sean Bridgers,Wendy Crewson",Lenny Abrahamson,,2015,118
1141,Django Unchained,"With the help of a German bounty hunter , a freed slave sets out to rescue his wife from a brutal Mississippi plantation owner.","Drama,Western","Jamie Foxx, Christoph Waltz, Leonardo DiCaprio,Kerry Washington",Quentin Tarantino,,2012,165
1142,Ah-ga-ssi,"A woman is hired as a handmaiden to a Japanese heiress, but secretly she is involved in a plot to defraud her.","Drama,Mystery,Romance","Min-hee Kim, Jung-woo Ha, Jin-woong Jo, So-ri Moon",Chan-wook Park,,2016,144
1143,The Edge of Seventeen,"High-school life gets even more unbearable for Nadine when her best friend, Krista, starts dating her older brother.","Comedy,Drama","Hailee Steinfeld, Haley Lu Richardson, Blake Jenner, Kyra Sedgwick",Kelly Fremon Craig,,2016,104
1144,Watchmen,"In 1985 where former superheroes exist, the murder of a colleague sends active vigilante Rorschach into his own sprawling investigation, uncovering something that could completely change the course of history as we know it.","Action,Drama,Mystery","Jackie Earle Haley, Patrick Wilson, Carla Gugino,Malin Akerman",Zack Snyder,,2009,162
1145,Superbad,Two co-dependent high school seniors are forced to deal with separation anxiety after their plan to stage a booze-soaked party goes awry.,Comedy,"Michael Cera, Jonah Hill, Christopher Mintz-Plasse, Bill Hader",Greg Mottola,,2007,113
1146,Inferno,"When Robert Langdon wakes up in an Italian hospital with amnesia, he teams up with Dr. Sienna Brooks, and together they must race across Europe against the clock to foil a deadly global plot.","Action,Adventure,Crime","Tom Hanks, Felicity Jones, Irrfan Khan, Ben Foster",Ron Howard,,2016,121
1147,The BFG,"An orphan little girl befriends a benevolent giant who takes her to Giant Country, where they attempt to stop the man-eating giants that are invading the human world.","Adventure,Family,Fantasy","Mark Rylance, Ruby Barnhill, Penelope Wilton,Jemaine Clement",Steven Spielberg,,2016,117
1148,The Hunger Games,Katniss Everdeen voluntarily takes her younger sister's place in the Hunger Games: a televised competition in which two teenagers from each of the twelve Districts of Panem are chosen at random to fight to the death.,"Adventure,Sci-Fi,Thriller","Jennifer Lawrence, Josh Hutcherson, Liam Hemsworth,Stanley Tucci",Gary Ross,,2012,142
1149,White Girl,"Summer, New York City. A college girl falls hard for a guy she just met. After a night of partying goes wrong, she goes to wild extremes to get him back.",Drama,"Morgan Saylor, Brian Marc, Justin Bartha, Adrian Martinez",Elizabeth Wood,,2016,88
1150,Sicario,An idealistic FBI agent is enlisted by a government task force to aid in the escalating war against drugs at the border area between the U.S. and Mexico.,"Action,Crime,Drama","Emily Blunt, Josh Brolin, Benicio Del Toro, Jon Bernthal",Denis Villeneuve,,2015,121
1151,Twin Peaks: The Missing Pieces,Twin Peaks before Twin Peaks (1990) and at the same time not always and entirely in the same place as Twin Peaks: Fire Walk with Me (1992). A feature film which presents deleted scenes from Twin Peaks: Fire Walk with Me (1992) assembled together for the first time in an untold portion of the story's prequel.,"Drama,Horror,Mystery","Chris Isaak, Kiefer Sutherland, C.H. Evans, Sandra Kinder",David Lynch,,2014,91
1152,Aliens vs Predator - Requiem,"Warring alien and predator races descend on a rural US town, where unsuspecting residents must band together for any chance of survival.","Action,Horror,Sci-Fi","Reiko Aylesworth, Steven Pasquale,Shareeka Epps, John Ortiz",Colin Strause,,2007,94
1153,Pacific Rim,"As a war between humankind and monstrous sea creatures wages on, a former pilot and a trainee are paired up to drive a seemingly obsolete special weapon in a desperate effort to save the world from the apocalypse.","Action,Adventure,Sci-Fi","Idris Elba, Charlie Hunnam, Rinko Kikuchi,Charlie Day",Guillermo del Toro,,2013,131
