,Title,Description,Genre,Actors,Director,rating,Year,Runtime (Minutes)
539,LUST LOCK,A Fanciful Panorama of a Hunter And a Dentist who must Meet a Secret Agent in The Sahara Desert,"Trailers,Commentaries,Behind the Scenes","Anne Cronyn, Charlize Dench, Sean Guiness, Salma Nolte, Ed Mansfield, Jayne Nolte, Matthew Carrey",,G,2006,52
540,MADIGAN DORADO,A Astounding Character Study of a A Shark And a A Shark who must Discover a Crocodile in The Outback,"Deleted Scenes,Behind the Scenes","Ray Johansson, Milla Keitel, Minnie Zellweger, Kirsten Akroyd, Jon Chase, Gene Mckellen",,R,2006,116
541,MADISON TRAP,A Awe-Inspiring Reflection of a Monkey And a Dentist who must Overcome a Pioneer in A U-Boat,"Commentaries,Deleted Scenes,Behind the Scenes","Rip Crawford, Jodie Degeneres, Walter Torn, Gregory Gooding, Thora Temple",,R,2006,147
542,MADNESS ATTACKS,A Fanciful Tale of a Squirrel And a Boat who must Defeat a Crocodile in The Gulf of Mexico,Trailers,"Frances Day-lewis, Scarlett Damon, Kirsten Akroyd, Susan Davis, Frances Tomei, Humphrey Willis, Mary Keitel",,PG-13,2006,178
543,MADRE GABLES,A Intrepid Panorama of a Sumo Wrestler And a Forensic Psychologist who must Discover a Moose in The First Manned Space Station,"Trailers,Commentaries,Deleted Scenes","Tom Miranda, Penelope Pinkett, Daryl Wahlberg, Matthew Carrey",,PG-13,2006,98
544,MAGIC MALLRATS,A Touching Documentary of a Pastry Chef And a Pastry Chef who must Build a Mad Scientist in California,"Trailers,Commentaries","Alec Wayne, Tom Mckellen, Burt Posey, Kirsten Akroyd",,PG,2006,117
545,MAGNIFICENT CHITTY,A Insightful Story of a Teacher And a Hunter who must Face a Mad Cow in California,"Commentaries,Deleted Scenes","Fred Costner, Gary Penn, Greg Chaplin, Kenneth Torn, Gina Degeneres, Renee Ball, Cuba Birch",,R,2006,53
546,MAGNOLIA FORRESTER,A Thoughtful Documentary of a Composer And a Explorer who must Conquer a Dentist in New Orleans,"Trailers,Commentaries,Deleted Scenes","Sandra Kilmer, Christian Akroyd, Groucho Sinatra, Greta Keitel, Laura Brody, Olympia Pfeiffer, Audrey Bailey",,PG-13,2006,171
547,MAGUIRE APACHE,A Fast-Paced Reflection of a Waitress And a Hunter who must Defeat a Forensic Psychologist in A Baloon,"Trailers,Commentaries","Nick Wahlberg, Sean Williams, Renee Tracy, Alan Dreyfuss",,NC-17,2006,74
548,MAIDEN HOME,A Lacklusture Saga of a Moose And a Teacher who must Kill a Forensic Psychologist in A MySQL Convention,Behind the Scenes,"Woody Hoffman, Christian Akroyd, Henry Berry, Woody Jolie, Kenneth Torn, Daryl Wahlberg, Jayne Nolte, Gregory Gooding",,PG,2006,138
549,MAJESTIC FLOATS,A Thrilling Character Study of a Moose And a Student who must Escape a Butler in The First Manned Space Station,Trailers,"Joe Swank, Natalie Hopkins, Groucho Sinatra, Ed Mansfield, Julia Zellweger",,PG,2006,130
550,MAKER GABLES,A Stunning Display of a Moose And a Database Administrator who must Pursue a Composer in A Jet Boat,"Deleted Scenes,Behind the Scenes","Cuba Olivier, Val Bolger, Christian Akroyd, Mary Tandy, Ralph Cruz, Kirsten Akroyd, Meg Hawke, Cuba Allen, Kevin Garland, Rita Reynolds, Lucille Dee",,PG-13,2006,136
551,MALKOVICH PET,A Intrepid Reflection of a Waitress And a A Shark who must Kill a Squirrel in The Outback,Behind the Scenes,"Grace Mostel, Matthew Johansson, Jada Ryder, Fay Winslet, Laurence Bullock, Michael Bolger, Reese West",,G,2006,159
552,MALLRATS UNITED,A Thrilling Yarn of a Waitress And a Dentist who must Find a Hunter in A Monastery,"Trailers,Commentaries,Deleted Scenes","Nick Wahlberg, Val Bolger, Cameron Zellweger, Vivien Basinger, Mary Keitel",,PG,2006,133
553,MALTESE HOPE,A Fast-Paced Documentary of a Crocodile And a Sumo Wrestler who must Conquer a Explorer in California,Behind the Scenes,Angela Hudson,,PG-13,2006,127
554,MANCHURIAN CURTAIN,A Stunning Tale of a Mad Cow And a Boy who must Battle a Boy in Berlin,"Trailers,Commentaries","Ray Johansson, Albert Nolte",,PG,2006,177
555,MANNEQUIN WORST,A Astounding Saga of a Mad Cow And a Pastry Chef who must Discover a Husband in Ancient India,"Trailers,Commentaries,Deleted Scenes","Anne Cronyn, Minnie Zellweger, Sidney Crowe, Cuba Allen, Gene Hopkins",,PG-13,2006,71
556,MARRIED GO,A Fanciful Story of a Womanizer And a Dog who must Face a Forensic Psychologist in The Sahara Desert,Behind the Scenes,"Goldie Brody, Frances Day-lewis, Groucho Dunst",,G,2006,114
557,MARS ROMAN,A Boring Drama of a Car And a Dog who must Succumb a Madman in Soviet Georgia,"Commentaries,Deleted Scenes","Adam Grant, River Dean, Olympia Pfeiffer, Michael Bolger, Cuba Birch, Jayne Silverstone, Bela Walken",,NC-17,2006,62
558,MASK PEACH,A Boring Character Study of a Student And a Robot who must Meet a Woman in California,"Commentaries,Deleted Scenes","Nick Wahlberg, Dan Torn, Gary Penn, Woody Jolie, Meg Hawke, Sidney Crowe, Warren Nolte, Lucille Dee, Laura Brody, Jeff Silverstone, Renee Ball",,NC-17,2006,123
559,MASKED BUBBLE,A Fanciful Documentary of a Pioneer And a Boat who must Pursue a Pioneer in An Abandoned Mine Shaft,"Commentaries,Behind the Scenes","Gary Penn, Adam Hopper, Audrey Bailey",,PG-13,2006,151
560,MASSACRE USUAL,A Fateful Reflection of a Waitress And a Crocodile who must Challenge a Forensic Psychologist in California,Commentaries,"Spencer Depp, Fay Winslet, Gene Mckellen",,R,2006,165
561,MASSAGE IMAGE,A Fateful Drama of a Frisbee And a Crocodile who must Vanquish a Dog in The First Manned Space Station,"Commentaries,Behind the Scenes","Kevin Bloom, Rip Crawford, Scarlett Damon, Charlize Dench, Kirsten Akroyd, Cate Mcqueen, Morgan Williams, Kenneth Hoffman, Alan Dreyfuss",,PG,2006,161
562,MATRIX SNOWMAN,A Action-Packed Saga of a Womanizer And a Woman who must Overcome a Student in California,"Commentaries,Deleted Scenes,Behind the Scenes","Sandra Peck, Gary Penn, Russell Bacall",,PG-13,2006,56
563,MAUDE MOD,A Beautiful Documentary of a Forensic Psychologist And a Cat who must Reach a Astronaut in Nigeria,"Trailers,Behind the Scenes","Cary Mcconaughey, James Pitt, Groucho Dunst, Olympia Pfeiffer, Ed Guiness, Rock Dukakis",,R,2006,72
564,MEET CHOCOLATE,A Boring Documentary of a Dentist And a Butler who must Confront a Monkey in A MySQL Convention,Trailers,"Zero Cage, Tim Hackman, Parker Goldberg, Warren Nolte, Warren Jackman, Groucho Williams",,G,2006,80
565,MEMENTO ZOOLANDER,A Touching Epistle of a Squirrel And a Explorer who must Redeem a Pastry Chef in The Sahara Desert,Behind the Scenes,"Tom Miranda, Angelina Astaire, Kirsten Akroyd, Susan Davis, Albert Nolte, Mary Keitel",,NC-17,2006,77
566,MENAGERIE RUSHMORE,A Unbelieveable Panorama of a Composer And a Butler who must Overcome a Database Administrator in The First Manned Space Station,"Trailers,Commentaries,Deleted Scenes","Burt Dukakis, Ray Johansson",,G,2006,147
567,MERMAID INSECTS,A Lacklusture Drama of a Waitress And a Husband who must Fight a Husband in California,"Trailers,Behind the Scenes","Frances Day-lewis, Spencer Peck, Warren Jackman, Ewan Gooding, Geoffrey Heston, Mary Keitel",,NC-17,2006,104
568,METAL ARMAGEDDON,A Thrilling Display of a Lumberjack And a Crocodile who must Meet a Monkey in A Baloon Factory,"Trailers,Commentaries,Deleted Scenes","Johnny Lollobrigida, Uma Wood, Angela Hudson, Gina Degeneres, Albert Johansson, Kenneth Hoffman, Alan Dreyfuss, Michael Bolger",,PG-13,2006,161
569,METROPOLIS COMA,A Emotional Saga of a Database Administrator And a Pastry Chef who must Confront a Teacher in A Baloon Factory,"Trailers,Commentaries,Behind the Scenes","Val Bolger, Dustin Tautou, Ray Johansson, Gene Willis, Jim Mostel, Cuba Allen",,PG-13,2006,64
570,MICROCOSMOS PARADISE,A Touching Character Study of a Boat And a Student who must Sink a A Shark in Nigeria,Commentaries,"Helen Voight, Mena Temple, Ellen Presley, Kevin Garland, Greta Malden, Jon Chase",,PG-13,2006,105
571,MIDNIGHT WESTWARD,A Taut Reflection of a Husband And a A Shark who must Redeem a Pastry Chef in A Monastery,"Trailers,Deleted Scenes","Woody Hoffman, Milla Peck, Adam Grant, James Pitt, Gina Degeneres, Geoffrey Heston, Greta Malden, Oprah Kilmer, Humphrey Garland",,G,2006,86
572,MIDSUMMER GROUNDHOG,A Fateful Panorama of a Moose And a Dog who must Chase a Crocodile in Ancient Japan,"Trailers,Deleted Scenes","Jada Ryder, Bela Walken",,G,2006,48
573,MIGHTY LUCK,A Astounding Epistle of a Mad Scientist And a Pioneer who must Escape a Database Administrator in A MySQL Convention,Behind the Scenes,"Julia Barrymore, Mena Temple, Jessica Bailey, Julianne Dench, Whoopi Hurt, River Dean, Russell Close, Bela Walken",,PG,2006,122
574,MILE MULAN,A Lacklusture Epistle of a Cat And a Husband who must Confront a Boy in A MySQL Convention,"Deleted Scenes,Behind the Scenes","Mena Temple, Angela Hudson, Julianne Dench",,PG,2006,64
575,MILLION ACE,A Brilliant Documentary of a Womanizer And a Squirrel who must Find a Technical Writer in The Sahara Desert,Deleted Scenes,"Christian Akroyd, Scarlett Damon, Renee Tracy, Ben Harris, John Suvari",,PG-13,2006,142
576,MINDS TRUMAN,A Taut Yarn of a Mad Scientist And a Crocodile who must Outgun a Database Administrator in A Monastery,"Deleted Scenes,Behind the Scenes","Anne Cronyn, Burt Posey, Scarlett Damon, Chris Depp, Matthew Carrey, Julia Zellweger",,PG-13,2006,149
577,MINE TITANS,A Amazing Yarn of a Robot And a Womanizer who must Discover a Forensic Psychologist in Berlin,"Trailers,Deleted Scenes","Nick Degeneres, Humphrey Garland",,PG-13,2006,166
578,MINORITY KISS,A Insightful Display of a Lumberjack And a Sumo Wrestler who must Meet a Man in The Outback,Trailers,Vivien Basinger,,G,2006,59
579,MIRACLE VIRTUAL,A Touching Epistle of a Butler And a Boy who must Find a Mad Scientist in The Sahara Desert,"Trailers,Deleted Scenes",Fred Costner,,PG-13,2006,162
580,MISSION ZOOLANDER,A Intrepid Story of a Sumo Wrestler And a Teacher who must Meet a A Shark in An Abandoned Fun House,Behind the Scenes,"Fred Costner, Kevin Bloom, Tom Mckellen, Penelope Cronyn, Lucille Dee",,PG-13,2006,164
581,MIXED DOORS,A Taut Drama of a Womanizer And a Lumberjack who must Succumb a Pioneer in Ancient India,Behind the Scenes,"Carmen Hunt, Michelle Mcconaughey, Dan Streep, Albert Nolte, Ian Tandy, Michael Bolger",,PG-13,2006,180
582,MOB DUFFEL,A Unbelieveable Documentary of a Frisbee And a Boat who must Meet a Boy in The Canadian Rockies,Trailers,"Cameron Streep, Sissy Sobieski, Tim Hackman, Christian Neeson, Matthew Leigh, Groucho Dunst",,G,2006,105
583,MOCKINGBIRD HOLLYWOOD,A Thoughtful Panorama of a Man And a Car who must Sink a Composer in Berlin,Behind the Scenes,"Julia Mcqueen, Sean Guiness, Adam Hopper",,PG,2006,60
584,MOD SECRETARY,A Boring Documentary of a Mad Cow And a Cat who must Build a Lumberjack in New Orleans,"Commentaries,Behind the Scenes","Christian Gable, Zero Cage, Goldie Brody, Whoopi Hurt, Lisa Monroe, Bela Walken",,NC-17,2006,77
585,MODEL FISH,A Beautiful Panorama of a Boat And a Crocodile who must Outrace a Dog in Australia,"Trailers,Commentaries,Behind the Scenes","Uma Wood, Val Bolger, Richard Penn, Gene Hopkins, Meryl Gibson, Harvey Hope, Ed Guiness, Mary Keitel",,NC-17,2006,175
586,MODERN DORADO,A Awe-Inspiring Story of a Butler And a Sumo Wrestler who must Redeem a Boy in New Orleans,"Trailers,Commentaries,Deleted Scenes","Lucille Tracy, Judy Dean, James Pitt, Julianne Dench, Cate Harris",,PG,2006,74
587,MONEY HAROLD,A Touching Tale of a Explorer And a Boat who must Defeat a Robot in Australia,"Trailers,Commentaries","Alec Wayne, Burt Dukakis, Gene Willis, Penelope Monroe, Jane Jackman, Ian Tandy, Debbie Akroyd",,PG,2006,135
588,MONSOON CAUSE,A Astounding Tale of a Crocodile And a Car who must Outrace a Squirrel in A U-Boat,"Commentaries,Behind the Scenes","Nick Stallone, Natalie Hopkins, Minnie Zellweger, Albert Johansson, William Hackman",,PG,2006,182
589,MONSTER SPARTACUS,A Fast-Paced Story of a Waitress And a Cat who must Fight a Girl in Australia,"Commentaries,Behind the Scenes","Jude Cruise, Warren Jackman, Greta Keitel, Kim Allen, Alan Dreyfuss, John Suvari, Jayne Silverstone",,PG,2006,107
590,MONTEREY LABYRINTH,A Awe-Inspiring Drama of a Monkey And a Composer who must Escape a Feminist in A U-Boat,"Trailers,Commentaries","Karl Berry, Julia Mcqueen, Dan Harris, Julianne Dench, Fay Wood, Rock Dukakis",,G,2006,158
591,MONTEZUMA COMMAND,A Thrilling Reflection of a Waitress And a Butler who must Battle a Butler in A Jet Boat,Trailers,"Cuba Olivier, Richard Penn",,NC-17,2006,126
592,MOON BUNCH,A Beautiful Tale of a Astronaut And a Mad Cow who must Challenge a Cat in A Baloon Factory,"Deleted Scenes,Behind the Scenes",Anne Cronyn,,PG,2006,83
593,MOONSHINE CABIN,A Thoughtful Display of a Astronaut And a Feminist who must Chase a Frisbee in A Jet Boat,Behind the Scenes,"Jodie Degeneres, Carmen Hunt, William Hackman, Matthew Carrey, Gregory Gooding",,PG-13,2006,171
594,MOONWALKER FOOL,A Epic Drama of a Feminist And a Pioneer who must Sink a Composer in New Orleans,"Trailers,Deleted Scenes","Zero Cage, Uma Wood, Woody Hoffman, Ray Johansson, Daryl Crawford, Humphrey Garland, Mary Keitel",,G,2006,184
595,MOSQUITO ARMAGEDDON,A Thoughtful Character Study of a Waitress And a Feminist who must Build a Teacher in Ancient Japan,Trailers,"Goldie Brody, Kirk Jovovich, Nick Stallone, Reese West",,G,2006,57
596,MOTHER OLEANDER,A Boring Tale of a Husband And a Boy who must Fight a Squirrel in Ancient China,"Trailers,Commentaries","Frances Day-lewis, Groucho Sinatra, Spencer Peck, Whoopi Hurt, Angela Witherspoon",,R,2006,103
597,MOTIONS DETAILS,A Awe-Inspiring Reflection of a Dog And a Student who must Kill a Car in An Abandoned Fun House,"Trailers,Commentaries,Behind the Scenes","Uma Wood, Elvis Marx, Burt Dukakis, Penelope Pinkett, Jim Mostel, Walter Torn, Penelope Cronyn, Laura Brody",,PG,2006,166
598,MOULIN WAKE,A Astounding Story of a Forensic Psychologist And a Cat who must Battle a Teacher in An Abandoned Mine Shaft,Trailers,"Jessica Bailey, Scarlett Bening, Vivien Basinger",,PG-13,2006,79
599,MOURNING PURPLE,A Lacklusture Display of a Waitress And a Lumberjack who must Chase a Pioneer in New Orleans,"Trailers,Commentaries,Deleted Scenes,Behind the Scenes","Christian Akroyd, Kenneth Pesci, Albert Nolte, Daryl Crawford, Ewan Gooding, Meryl Gibson, Will Wilson",,PG,2006,146
600,MOVIE SHAKESPEARE,A Insightful Display of a Database Administrator And a Student who must Build a Hunter in Berlin,"Commentaries,Deleted Scenes,Behind the Scenes","Helen Voight, Cameron Streep, Fay Kilmer, Gina Degeneres, Cameron Zellweger, Russell Bacall, Morgan Williams, River Dean",,PG,2006,53
601,MULAN MOON,A Emotional Saga of a Womanizer And a Pioneer who must Overcome a Dentist in A Baloon,Behind the Scenes,"Nick Stallone, Angelina Astaire, Greta Malden, Matthew Carrey, Julia Fawcett",,G,2006,160
602,MULHOLLAND BEAST,A Awe-Inspiring Display of a Husband And a Squirrel who must Battle a Sumo Wrestler in A Jet Boat,"Trailers,Deleted Scenes,Behind the Scenes","Penelope Guiness, Bette Nicholson, Kirk Jovovich, Jude Cruise, Walter Torn, Ewan Gooding",,PG,2006,157
603,MUMMY CREATURES,A Fateful Character Study of a Crocodile And a Monkey who must Meet a Dentist in Australia,"Trailers,Behind the Scenes","Helen Voight, Kevin Bloom, Tim Hackman, Goldie Brody, Angelina Astaire, Spencer Peck, Walter Torn, Sidney Crowe, Gina Degeneres, Russell Bacall, Dan Streep, Rock Dukakis, Audrey Bailey",,NC-17,2006,160
604,MUPPET MILE,A Lacklusture Story of a Madman And a Teacher who must Kill a Frisbee in The Gulf of Mexico,"Trailers,Deleted Scenes","Rip Winslet, Mae Hoffman, Chris Bridges, Penelope Cronyn, Harrison Bale, Cate Harris, Ben Harris, Al Garland",,PG,2006,50
605,MURDER ANTITRUST,A Brilliant Yarn of a Car And a Database Administrator who must Escape a Boy in A MySQL Convention,"Trailers,Deleted Scenes,Behind the Scenes","Kirk Jovovich, Mary Tandy, Christopher Berry, Susan Davis, Cameron Zellweger, Whoopi Hurt, Jada Ryder, Olympia Pfeiffer",,PG,2006,166
606,MUSCLE BRIGHT,A Stunning Panorama of a Sumo Wrestler And a Husband who must Redeem a Madman in Ancient India,Deleted Scenes,"Sean Williams, Matthew Leigh, Groucho Williams, Jeff Silverstone, Matthew Carrey",,G,2006,185
607,MUSIC BOONDOCK,A Thrilling Tale of a Butler And a Astronaut who must Battle a Explorer in The First Manned Space Station,"Trailers,Commentaries,Behind the Scenes","Morgan Williams, Humphrey Willis, Michael Bening",,R,2006,129
608,MUSKETEERS WAIT,A Touching Yarn of a Student And a Moose who must Fight a Mad Cow in Australia,"Deleted Scenes,Behind the Scenes",Ben Harris,,PG,2006,73
609,MUSSOLINI SPOILERS,A Thrilling Display of a Boat And a Monkey who must Meet a Composer in Ancient China,"Deleted Scenes,Behind the Scenes","Vivien Bergen, Dan Torn, Judy Dean, Fay Kilmer, Kenneth Paltrow, Cary Mcconaughey, Oprah Kilmer",,G,2006,180
610,MYSTIC TRUMAN,A Epic Yarn of a Teacher And a Hunter who must Outgun a Explorer in Soviet Georgia,"Commentaries,Behind the Scenes","Scarlett Damon, Kevin Garland, River Dean, Humphrey Willis",,NC-17,2006,92
611,NAME DETECTIVE,A Touching Saga of a Sumo Wrestler And a Cat who must Pursue a Mad Scientist in Nigeria,"Trailers,Commentaries,Behind the Scenes","Warren Jackman, Cate Mcqueen, John Suvari",,PG-13,2006,178
612,NASH CHOCOLAT,A Epic Reflection of a Monkey And a Mad Cow who must Kill a Forensic Psychologist in An Abandoned Mine Shaft,"Commentaries,Behind the Scenes","Judy Dean, Angela Hudson, Ben Willis, Harrison Bale, Ben Harris, Humphrey Garland, Bela Walken",,PG-13,2006,180
613,NATIONAL STORY,A Taut Epistle of a Mad Scientist And a Girl who must Escape a Monkey in California,Trailers,"Jennifer Davis, Ray Johansson, James Pitt, Rita Reynolds, Greta Malden, Vivien Basinger, William Hackman",,NC-17,2006,92
614,NATURAL STOCK,A Fast-Paced Story of a Sumo Wrestler And a Girl who must Defeat a Car in A Baloon Factory,"Commentaries,Deleted Scenes","Milla Keitel, Susan Davis, Kevin Garland, Renee Ball",,PG-13,2006,50
615,NECKLACE OUTBREAK,A Astounding Epistle of a Database Administrator And a Mad Scientist who must Pursue a Cat in California,"Trailers,Commentaries,Behind the Scenes","Ed Chase, Grace Mostel, Milla Peck, Tom Mckellen, Kirsten Akroyd, Jim Mostel, Michael Bening, John Suvari",,PG,2006,132
616,NEIGHBORS CHARADE,A Fanciful Reflection of a Crocodile And a Astronaut who must Outrace a Feminist in An Abandoned Amusement Park,"Trailers,Commentaries,Deleted Scenes","Woody Hoffman, Tom Mckellen, Ralph Cruz, Scarlett Damon, Daryl Wahlberg, Morgan Mcdormand, Will Wilson",,R,2006,161
617,NEMO CAMPUS,A Lacklusture Reflection of a Monkey And a Squirrel who must Outrace a Womanizer in A Manhattan Penthouse,Trailers,"Fay Kilmer, Kenneth Pesci, Jim Mostel, Salma Nolte, Ed Mansfield",,NC-17,2006,131
618,NETWORK PEAK,A Unbelieveable Reflection of a Butler And a Boat who must Outgun a Mad Scientist in California,"Commentaries,Deleted Scenes,Behind the Scenes","Kirk Jovovich, Natalie Hopkins, Ellen Presley",,PG-13,2006,75
619,NEWSIES STORY,A Action-Packed Character Study of a Dog And a Lumberjack who must Outrace a Moose in The Gulf of Mexico,"Trailers,Deleted Scenes","Ralph Cruz, Jim Mostel, Sylvester Dern, Dan Streep, Nick Degeneres, Michael Bening, Jeff Silverstone, John Suvari",,G,2006,159
620,NEWTON LABYRINTH,A Intrepid Character Study of a Moose And a Waitress who must Find a A Shark in Ancient India,"Trailers,Commentaries,Deleted Scenes,Behind the Scenes","Sean Williams, Greg Chaplin, Albert Nolte, Audrey Bailey",,PG,2006,75
621,NIGHTMARE CHILL,A Brilliant Display of a Robot And a Butler who must Fight a Waitress in An Abandoned Mine Shaft,"Trailers,Deleted Scenes,Behind the Scenes","Walter Torn, Gene Hopkins",,PG,2006,149
622,NONE SPIKING,A Boring Reflection of a Secret Agent And a Astronaut who must Face a Composer in A Manhattan Penthouse,"Trailers,Commentaries","Woody Hoffman, Susan Davis, Kim Allen, Olympia Pfeiffer, Matthew Carrey, Renee Ball",,NC-17,2006,83
623,NOON PAPI,A Unbelieveable Character Study of a Mad Scientist And a Astronaut who must Find a Pioneer in A Manhattan Penthouse,Behind the Scenes,"Cuba Olivier, Milla Keitel, Adam Hopper, Vivien Basinger, Laurence Bullock, Will Wilson",,G,2006,57
624,NORTH TEQUILA,A Beautiful Character Study of a Mad Cow And a Robot who must Reach a Womanizer in New Orleans,"Commentaries,Deleted Scenes,Behind the Scenes","Gary Phoenix, Gary Penn, Daryl Wahlberg, Lucille Dee, Minnie Kilmer",,NC-17,2006,67
625,NORTHWEST POLISH,A Boring Character Study of a Boy And a A Shark who must Outrace a Womanizer in The Outback,Trailers,"Michelle Mcconaughey, Mae Hoffman, Rita Reynolds, Laurence Bullock, Jeff Silverstone, Cuba Birch, Reese West, Mary Keitel",,PG,2006,172
626,NOTORIOUS REUNION,A Amazing Epistle of a Woman And a Squirrel who must Fight a Hunter in A Baloon,"Trailers,Commentaries,Deleted Scenes","Kim Allen, Jayne Nolte",,NC-17,2006,128
627,NOTTING SPEAKEASY,A Thoughtful Display of a Butler And a Womanizer who must Find a Waitress in The Canadian Rockies,"Trailers,Commentaries","Minnie Zellweger, Ian Tandy",,PG-13,2006,48
628,NOVOCAINE FLIGHT,A Fanciful Display of a Student And a Teacher who must Outgun a Crocodile in Nigeria,"Trailers,Commentaries,Deleted Scenes","Karl Berry, Ben Willis, Greg Chaplin, Walter Torn, Russell Temple, Michael Bolger",,G,2006,64
629,NUTS TIES,A Thoughtful Drama of a Explorer And a Womanizer who must Meet a Teacher in California,"Trailers,Behind the Scenes","Natalie Hopkins, Christian Akroyd",,NC-17,2006,145
630,OCTOBER SUBMARINE,A Taut Epistle of a Monkey And a Boy who must Confront a Husband in A Jet Boat,"Trailers,Commentaries,Behind the Scenes","Grace Mostel, Cameron Wray, Sean Guiness, Liza Bergman, Emily Dee",,PG-13,2006,54
631,ODDS BOOGIE,A Thrilling Yarn of a Feminist And a Madman who must Battle a Hunter in Berlin,"Trailers,Commentaries,Behind the Scenes","Elvis Marx, Mae Hoffman, Chris Bridges, Geoffrey Heston, Kenneth Hoffman",,NC-17,2006,48
632,OKLAHOMA JUMANJI,A Thoughtful Drama of a Dentist And a Womanizer who must Meet a Husband in The Sahara Desert,Behind the Scenes,"Penelope Guiness, Jennifer Davis, Karl Berry, Cuba Olivier, Rip Crawford, Christian Akroyd, Cary Mcconaughey, Richard Penn, Bela Walken",,PG,2006,58
633,OLEANDER CLUE,A Boring Story of a Teacher And a Monkey who must Succumb a Forensic Psychologist in A Jet Boat,"Commentaries,Deleted Scenes","Zero Cage, Sandra Kilmer, Penelope Pinkett, Sean Williams, Greg Chaplin, Jim Mostel, Warren Jackman, Ewan Gooding, Oprah Kilmer, Russell Close",,PG,2006,161
634,OPEN AFRICAN,A Lacklusture Drama of a Secret Agent And a Explorer who must Discover a Car in A U-Boat,"Trailers,Commentaries","Grace Mostel, Julia Mcqueen, Sissy Sobieski, Jude Cruise, Milla Keitel, Gina Degeneres, Adam Hopper, Vivien Basinger, Julia Zellweger",,PG,2006,131
635,OPERATION OPERATION,A Intrepid Character Study of a Man And a Frisbee who must Overcome a Madman in Ancient China,"Trailers,Commentaries,Deleted Scenes,Behind the Scenes","Christian Akroyd, Adam Grant, Gregory Gooding",,G,2006,156
636,OPPOSITE NECKLACE,A Fateful Epistle of a Crocodile And a Moose who must Kill a Explorer in Nigeria,Deleted Scenes,"Christian Neeson, Matthew Leigh, Groucho Dunst, Lucille Dee, Groucho Williams, Debbie Akroyd",,PG,2006,92
637,OPUS ICE,A Fast-Paced Drama of a Hunter And a Boy who must Discover a Feminist in The Sahara Desert,"Commentaries,Deleted Scenes","Sean Williams, Daryl Crawford, Humphrey Garland, Julia Fawcett",,R,2006,102
638,ORANGE GRAPES,A Astounding Documentary of a Butler And a Womanizer who must Face a Dog in A U-Boat,"Trailers,Commentaries","Meg Hawke, Cuba Allen, Penelope Monroe, Kevin Garland, Kim Allen",,PG-13,2006,76
639,ORDER BETRAYED,A Amazing Saga of a Dog And a A Shark who must Challenge a Cat in The Sahara Desert,"Deleted Scenes,Behind the Scenes","Angelina Astaire, Spencer Depp, Morgan Hopkins, Penelope Monroe, Greta Malden, Kenneth Hoffman, Humphrey Garland",,PG-13,2006,120
640,ORIENT CLOSER,A Astounding Epistle of a Technical Writer And a Teacher who must Fight a Squirrel in The Sahara Desert,"Commentaries,Deleted Scenes","Lucille Tracy, Scarlett Damon, Matthew Leigh, Cameron Zellweger",,R,2006,118
641,OSCAR GOLD,A Insightful Tale of a Database Administrator And a Dog who must Face a Madman in Soviet Georgia,Behind the Scenes,"Bob Fawcett, Rip Crawford, Dustin Tautou, Ellen Presley, Harvey Hope, Al Garland",,PG,2006,115
642,OTHERS SOUP,A Lacklusture Documentary of a Mad Cow And a Madman who must Sink a Moose in The Gulf of Mexico,Deleted Scenes,"Frances Day-lewis, Natalie Hopkins, Burt Posey, Olympia Pfeiffer",,PG,2006,118
643,OUTBREAK DIVINE,A Unbelieveable Yarn of a Database Administrator And a Woman who must Succumb a A Shark in A U-Boat,"Trailers,Deleted Scenes,Behind the Scenes","Alec Wayne, Ray Johansson, Mae Hoffman, James Pitt, Fay Wood",,NC-17,2006,169
644,OUTFIELD MASSACRE,A Thoughtful Drama of a Husband And a Secret Agent who must Pursue a Database Administrator in Ancient India,"Trailers,Deleted Scenes","Dan Streep, Jane Jackman, Whoopi Hurt, Jayne Nolte",,NC-17,2006,129
645,OUTLAW HANKY,A Thoughtful Story of a Astronaut And a Composer who must Conquer a Dog in The Sahara Desert,"Trailers,Commentaries","Elvis Marx, Goldie Brody, Tom Miranda, Christian Neeson, Angelina Astaire, Warren Nolte, Julia Zellweger",,PG-13,2006,148
646,OZ LIAISONS,A Epic Yarn of a Mad Scientist And a Cat who must Confront a Womanizer in A Baloon Factory,"Commentaries,Deleted Scenes,Behind the Scenes","Sandra Kilmer, Penelope Pinkett, Christian Neeson, Sidney Crowe, Warren Jackman, Salma Nolte, Ed Mansfield, Fay Winslet, Groucho Williams, Gene Mckellen, Jayne Silverstone",,R,2006,85
647,PACIFIC AMISTAD,A Thrilling Yarn of a Dog And a Moose who must Kill a Pastry Chef in A Manhattan Penthouse,"Trailers,Commentaries,Deleted Scenes,Behind the Scenes","Johnny Lollobrigida, Joe Swank, Dustin Tautou, Angelina Astaire, Susan Davis, Cate Mcqueen, Ed Guiness, Humphrey Garland",,G,2006,144
