,Title,Description,Genre,Actors,Director,rating,Year,Runtime (Minutes)
0,ACADEMY DINOSAUR,A Epic Drama of a Feminist And a Mad Scientist who must Battle a Teacher in The Canadian Rockies,"Deleted Scenes,Behind the Scenes","Penelope Guiness, Christian Gable, Lucille Tracy, Sandra Peck, Johnny Cage, Mena Temple, Warren Nolte, Oprah Kilmer, Rock Dukakis, Mary Keitel",,PG,2006,86
1,ACE GOLDFINGER,A Astounding Epistle of a Database Administrator And a Explorer who must Find a Car in Ancient China,"Trailers,Deleted Scenes","Bob Fawcett, Minnie Zellweger, Sean Guiness, Chris Depp",,G,2006,48
2,ADAPTATION HOLES,A Astounding Reflection of a Lumberjack And a Car who must Sink a Lumberjack in A Baloon Factory,"Trailers,Deleted Scenes","Nick Wahlberg, Bob Fawcett, Cameron Streep, Ray Johansson, Julianne Dench",,NC-17,2006,50
3,AFFAIR PREJUDICE,A Fanciful Documentary of a Frisbee And a Lumberjack who must Chase a Monkey in A Shark Tank,"Commentaries,Behind the Scenes","Jodie Degeneres, Scarlett Damon, Kenneth Pesci, Fay Winslet, Oprah Kilmer",,G,2006,117
4,AFRICAN EGG,A Fast-Paced Documentary of a Pastry Chef And a Dentist who must Pursue a Forensic Psychologist in The Gulf of Mexico,Deleted Scenes,"Gary Phoenix, Dustin Tautou, Matthew Leigh, Matthew Carrey, Thora Temple",,G,2006,130
5,AGENT TRUMAN,A Intrepid Panorama of a Robot And a Boy who must Escape a Sumo Wrestler in Ancient China,Deleted Scenes,"Kirsten Paltrow, Sandra Kilmer, Jayne Neeson, Warren Nolte, Morgan Williams, Kenneth Hoffman, Reese West",,PG,2006,169
6,AIRPLANE SIERRA,A Touching Saga of a Hunter And a Butler who must Discover a Butler in A Jet Boat,"Trailers,Deleted Scenes","Jim Mostel, Richard Penn, Oprah Kilmer, Mena Hopper, Michael Bolger",,PG-13,2006,62
7,AIRPORT POLLOCK,A Epic Tale of a Moose And a Girl who must Confront a Monkey in Ancient India,Trailers,"Fay Kilmer, Gene Willis, Susan Davis, Lucille Dee",,R,2006,54
8,ALABAMA DEVIL,A Thoughtful Panorama of a Database Administrator And a Mad Scientist who must Outgun a Mad Scientist in A Jet Boat,"Trailers,Deleted Scenes","Christian Gable, Elvis Marx, Rip Crawford, Mena Temple, Rip Winslet, Warren Nolte, Greta Keitel, William Hackman, Meryl Allen",,PG-13,2006,114
9,ALADDIN CALENDAR,A Action-Packed Tale of a Man And a Lumberjack who must Reach a Feminist in Ancient China,"Trailers,Deleted Scenes","Alec Wayne, Judy Dean, Val Bolger, Ray Johansson, Renee Tracy, Jada Ryder, Greta Malden, Rock Dukakis",,NC-17,2006,63
10,ALAMO VIDEOTAPE,A Boring Epistle of a Butler And a Cat who must Fight a Pastry Chef in A MySQL Convention,"Commentaries,Behind the Scenes","Johnny Cage, Scarlett Damon, Sean Guiness, Michael Bening",,G,2006,126
11,ALASKA PHANTOM,A Fanciful Saga of a Hunter And a Pastry Chef who must Vanquish a Boy in Australia,"Commentaries,Deleted Scenes","Val Bolger, Burt Posey, Sidney Crowe, Sylvester Dern, Albert Johansson, Gene Mckellen, Jeff Silverstone",,PG,2006,136
12,ALI FOREVER,A Action-Packed Drama of a Dentist And a Crocodile who must Battle a Feminist in The Canadian Rockies,"Deleted Scenes,Behind the Scenes","Cary Mcconaughey, Christopher Berry, Kenneth Torn, Morgan Mcdormand, Jon Chase",,PG,2006,150
13,ALICE FANTASIA,A Emotional Drama of a A Shark And a Database Administrator who must Vanquish a Pioneer in Soviet Georgia,"Trailers,Deleted Scenes,Behind the Scenes","Woody Hoffman, Minnie Zellweger, Morgan Williams, Rock Dukakis",,NC-17,2006,94
14,ALIEN CENTER,A Brilliant Drama of a Cat And a Mad Scientist who must Battle a Feminist in A MySQL Convention,"Trailers,Commentaries,Behind the Scenes","Burt Dukakis, Kenneth Paltrow, Sidney Crowe, Renee Tracy, Humphrey Willis, Mena Hopper",,NC-17,2006,46
15,ALLEY EVOLUTION,A Fast-Paced Drama of a Robot And a Composer who must Battle a Astronaut in New Orleans,"Trailers,Commentaries","Karl Berry, Jude Cruise, Albert Johansson, Gregory Gooding, John Suvari",,NC-17,2006,180
16,ALONE TRIP,A Fast-Paced Character Study of a Composer And a Dog who must Outgun a Boat in An Abandoned Fun House,"Trailers,Behind the Scenes","Ed Chase, Karl Berry, Uma Wood, Woody Jolie, Spencer Depp, Chris Depp, Laurence Bullock, Renee Ball",,R,2006,82
17,ALTER VICTORY,A Thoughtful Drama of a Composer And a Feminist who must Meet a Secret Agent in The Canadian Rockies,"Trailers,Behind the Scenes","Reese Kilmer, Jada Ryder, Angela Witherspoon, Oprah Kilmer",,PG-13,2006,57
18,AMADEUS HOLY,A Emotional Display of a Pioneer And a Technical Writer who must Battle a Man in A Baloon,"Commentaries,Deleted Scenes,Behind the Scenes","Johnny Lollobrigida, Julia Mcqueen, Val Bolger, Kirk Jovovich, James Pitt, Penelope Cronyn",,PG,2006,113
19,AMELIE HELLFIGHTERS,A Boring Drama of a Woman And a Squirrel who must Conquer a Student in A Baloon,"Commentaries,Deleted Scenes,Behind the Scenes","Carmen Hunt, Walter Torn, Ed Mansfield, Ewan Gooding, Ian Tandy, Laura Brody",,R,2006,79
20,AMERICAN CIRCUS,A Insightful Drama of a Girl And a Astronaut who must Face a Database Administrator in A Shark Tank,"Commentaries,Behind the Scenes","Kevin Bloom, Rip Crawford, Sidney Crowe, Warren Jackman, Frances Tomei",,R,2006,129
21,AMISTAD MIDSUMMER,A Emotional Character Study of a Dentist And a Crocodile who must Meet a Sumo Wrestler in California,"Commentaries,Behind the Scenes","Cary Mcconaughey, Daryl Wahlberg, Salma Nolte, Scarlett Bening",,G,2006,85
22,ANACONDA CONFESSIONS,A Lacklusture Display of a Dentist And a Dentist who must Fight a Girl in Australia,"Trailers,Deleted Scenes","Penelope Guiness, Jennifer Davis, Elvis Marx, Jayne Nolte, Humphrey Willis",,R,2006,92
23,ANALYZE HOOSIERS,A Thoughtful Display of a Explorer And a Pastry Chef who must Overcome a Feminist in The Sahara Desert,"Trailers,Behind the Scenes","Tom Mckellen, Tom Miranda, Jessica Bailey, Greta Malden, Ed Guiness",,R,2006,181
24,ANGELS LIFE,A Thoughtful Display of a Woman And a Astronaut who must Battle a Robot in Berlin,Trailers,"Penelope Guiness, Jennifer Davis, Grace Mostel, Julia Barrymore, Christopher Berry, Ed Mansfield, Nick Degeneres, Laurence Bullock, Renee Ball",,G,2006,74
25,ANNIE IDENTITY,A Amazing Panorama of a Pastry Chef And a Boat who must Escape a Woman in An Abandoned Amusement Park,"Commentaries,Deleted Scenes","Adam Grant, Cate Mcqueen, Greta Keitel",,G,2006,86
26,ANONYMOUS HUMAN,A Amazing Reflection of a Database Administrator And a Astronaut who must Outrace a Database Administrator in A Shark Tank,"Deleted Scenes,Behind the Scenes","Grace Mostel, Fay Kilmer, Jim Mostel, Susan Davis, Whoopi Hurt, Emily Dee, Meryl Gibson, Mena Hopper, Ed Guiness",,NC-17,2006,179
27,ANTHEM LUKE,A Touching Panorama of a Waitress And a Woman who must Outrace a Dog in An Abandoned Amusement Park,"Deleted Scenes,Behind the Scenes","Milla Keitel, Oprah Kilmer",,PG-13,2006,91
28,ANTITRUST TOMATOES,A Fateful Yarn of a Womanizer And a Feminist who must Succumb a Database Administrator in Ancient India,"Trailers,Commentaries,Deleted Scenes","Bette Nicholson, Uma Wood, Sidney Crowe, Salma Nolte, William Hackman, Renee Ball, Reese West",,NC-17,2006,168
29,ANYTHING SAVANNAH,A Epic Story of a Pastry Chef And a Woman who must Chase a Feminist in An Abandoned Fun House,"Trailers,Deleted Scenes,Behind the Scenes","Joe Swank, Christopher West, Lisa Monroe",,R,2006,82
30,APACHE DIVINE,A Awe-Inspiring Reflection of a Pastry Chef And a Teacher who must Overcome a Sumo Wrestler in A U-Boat,"Commentaries,Deleted Scenes,Behind the Scenes","Nick Wahlberg, Cuba Olivier, Anne Cronyn, Henry Berry",,NC-17,2006,92
31,APOCALYPSE FLAMINGOS,A Astounding Story of a Dog And a Squirrel who must Defeat a Woman in An Abandoned Amusement Park,"Trailers,Commentaries","Mae Hoffman, Vivien Basinger, Oprah Kilmer, Will Wilson, Russell Close",,R,2006,119
32,APOLLO TEEN,A Action-Packed Reflection of a Crocodile And a Explorer who must Find a Sumo Wrestler in An Abandoned Mine Shaft,"Trailers,Commentaries,Deleted Scenes,Behind the Scenes","Mae Hoffman, Woody Jolie, Ed Mansfield, Albert Johansson, Oprah Kilmer, Mena Hopper, Jeff Silverstone, Debbie Akroyd",,PG-13,2006,153
33,ARABIA DOGMA,A Touching Epistle of a Madman And a Mad Cow who must Defeat a Student in Nigeria,"Commentaries,Deleted Scenes","Karl Berry, Rip Crawford, Julia Mcqueen, Johnny Cage, Jude Cruise, Sean Williams, Burt Posey, Walter Torn, Russell Bacall, Frances Tomei, Greta Malden, Lisa Monroe",,NC-17,2006,62
34,ARACHNOPHOBIA ROLLERCOASTER,A Action-Packed Reflection of a Pastry Chef And a Composer who must Discover a Mad Scientist in The First Manned Space Station,"Trailers,Deleted Scenes,Behind the Scenes","Grace Mostel, Judy Dean, Daryl Wahlberg, Morgan Hopkins, Cuba Allen, Rita Reynolds, Ewan Gooding, Humphrey Garland",,PG-13,2006,147
35,ARGONAUTS TOWN,A Emotional Epistle of a Forensic Psychologist And a Butler who must Challenge a Waitress in An Abandoned Mine Shaft,"Trailers,Commentaries","Julia Barrymore, Gary Penn, Gene Willis, Dan Streep, Kevin Garland",,PG-13,2006,127
36,ARIZONA BANG,A Brilliant Panorama of a Mad Scientist And a Mad Cow who must Meet a Pioneer in A Monastery,"Trailers,Deleted Scenes","Karl Berry, Ray Johansson, Russell Bacall, Greta Keitel",,PG,2006,121
37,ARK RIDGEMONT,A Beautiful Yarn of a Pioneer And a Monkey who must Pursue a Explorer in The Sahara Desert,"Trailers,Commentaries,Deleted Scenes,Behind the Scenes","Parker Goldberg, Nick Degeneres, Audrey Bailey",,NC-17,2006,68
38,ARMAGEDDON LOST,A Fast-Paced Tale of a Boat And a Teacher who must Succumb a Composer in An Abandoned Mine Shaft,Trailers,"Angela Hudson, James Pitt, Penelope Cronyn, Cuba Allen, Kim Allen, Gene Mckellen, Gregory Gooding",,G,2006,99
39,ARMY FLINTSTONES,A Boring Saga of a Database Administrator And a Womanizer who must Battle a Waitress in Nigeria,"Trailers,Commentaries","Ed Chase, Cary Mcconaughey, Mae Hoffman, Gene Willis, Penelope Cronyn, Matthew Carrey, Russell Close",,R,2006,148
40,ARSENIC INDEPENDENCE,A Fanciful Documentary of a Mad Cow And a Womanizer who must Find a Dentist in Berlin,"Trailers,Deleted Scenes,Behind the Scenes","Cuba Allen, Rita Reynolds, Oprah Kilmer",,PG,2006,137
41,ARTIST COLDBLOODED,A Stunning Reflection of a Robot And a Moose who must Challenge a Woman in California,"Trailers,Behind the Scenes","Ed Chase, Sandra Kilmer, Kirk Jovovich, Jayne Neeson, Sidney Crowe, Renee Tracy, Meryl Allen",,NC-17,2006,170
42,ATLANTIS CAUSE,A Thrilling Yarn of a Feminist And a Hunter who must Fight a Technical Writer in A Shark Tank,Behind the Scenes,"Woody Hoffman, Audrey Olivier, Julianne Dench, Frances Tomei, Greta Keitel, Cate Harris, Chris Depp, Harvey Hope, Cuba Birch",,G,2006,170
43,ATTACKS HATE,A Fast-Paced Panorama of a Technical Writer And a Mad Scientist who must Find a Feminist in An Abandoned Mine Shaft,"Trailers,Behind the Scenes","Dan Torn, Milla Keitel, Groucho Dunst, Burt Temple",,PG-13,2006,113
44,ATTRACTION NEWTON,A Astounding Panorama of a Composer And a Frisbee who must Reach a Husband in Ancient Japan,"Trailers,Behind the Scenes","Uma Wood, Rip Winslet, Gary Penn, Christopher West",,PG-13,2006,83
45,AUTUMN CROW,A Beautiful Tale of a Dentist And a Mad Cow who must Battle a Moose in The Sahara Desert,"Trailers,Commentaries,Deleted Scenes,Behind the Scenes","Dustin Tautou, Angela Hudson, James Pitt",,G,2006,108
46,BABY HALL,A Boring Character Study of a A Shark And a Girl who must Outrace a Feminist in An Abandoned Mine Shaft,Commentaries,"Nick Wahlberg, Matthew Johansson, Charlize Dench, Daryl Wahlberg, Kevin Garland, River Dean, Minnie Kilmer, Vivien Basinger",,NC-17,2006,153
47,BACKLASH UNDEFEATED,A Stunning Character Study of a Mad Scientist And a Mad Cow who must Kill a Car in A Monastery,"Trailers,Behind the Scenes","Christian Akroyd, Spencer Peck, Christopher Berry, Sylvester Dern, Dan Streep, Kevin Garland, Jane Jackman",,PG-13,2006,118
48,BADMAN DAWN,A Emotional Panorama of a Pioneer And a Composer who must Escape a Mad Scientist in A Jet Boat,"Trailers,Commentaries,Behind the Scenes","Ben Willis, Harrison Bale, Cuba Allen, Warren Jackman, Greta Keitel, Olympia Pfeiffer, Alan Dreyfuss, Thora Temple",,R,2006,162
49,BAKED CLEOPATRA,A Stunning Drama of a Forensic Psychologist And a Husband who must Overcome a Waitress in A Monastery,"Commentaries,Behind the Scenes",Michelle Mcconaughey,,G,2006,182
50,BALLOON HOMEWARD,A Insightful Panorama of a Forensic Psychologist And a Mad Cow who must Build a Mad Scientist in The First Manned Space Station,Deleted Scenes,"Parker Goldberg, Mena Temple, Gary Penn, Richard Penn, Renee Ball, Rock Dukakis",,NC-17,2006,75
51,BALLROOM MOCKINGBIRD,A Thrilling Documentary of a Composer And a Monkey who must Find a Feminist in California,"Commentaries,Deleted Scenes","Judy Dean, Adam Grant, Ben Willis, Daryl Wahlberg, Harrison Bale, Lucille Dee, Gene Mckellen",,G,2006,173
52,BANG KWAI,A Epic Drama of a Madman And a Cat who must Face a A Shark in An Abandoned Amusement Park,"Commentaries,Deleted Scenes,Behind the Scenes","Bette Nicholson, Sandra Peck, Julia Barrymore, Michelle Mcconaughey, Walter Torn, Russell Temple, Fay Wood",,NC-17,2006,87
53,BANGER PINOCCHIO,A Awe-Inspiring Drama of a Car And a Pastry Chef who must Chase a Crocodile in The First Manned Space Station,"Trailers,Commentaries,Deleted Scenes","Johnny Lollobrigida, Lucille Tracy, Dustin Tautou, Jayne Neeson, Gene Willis, Audrey Bailey",,R,2006,113
54,BARBARELLA STREETCAR,A Awe-Inspiring Story of a Feminist And a Cat who must Conquer a Dog in A Monastery,Behind the Scenes,"Mary Tandy, Cuba Allen, Nick Degeneres, Alan Dreyfuss, Gene Mckellen",,G,2006,65
55,BAREFOOT MANCHURIAN,A Intrepid Story of a Cat And a Student who must Vanquish a Girl in An Abandoned Amusement Park,"Trailers,Commentaries","Jennifer Davis, Elvis Marx, Milla Peck, Kirk Jovovich, Daryl Crawford, Ed Mansfield, Morgan Williams, Will Wilson",,G,2006,129
56,BASIC EASY,A Stunning Epistle of a Man And a Husband who must Reach a Mad Scientist in A Jet Boat,Deleted Scenes,"Jessica Bailey, Penelope Monroe, Greta Keitel, Ewan Gooding, Emily Dee, Groucho Williams",,PG-13,2006,90
57,BEACH HEARTBREAKERS,A Fateful Display of a Womanizer And a Mad Scientist who must Outgun a A Shark in Soviet Georgia,"Deleted Scenes,Behind the Scenes","Woody Hoffman, Nick Stallone, Mena Temple, Ben Willis, Gene Willis, Frances Tomei, Harvey Hope",,G,2006,122
58,BEAR GRACELAND,A Astounding Saga of a Dog And a Boy who must Kill a Teacher in The First Manned Space Station,Deleted Scenes,"Scarlett Damon, Penelope Cronyn, Ben Harris",,R,2006,160
59,BEAST HUNCHBACK,A Awe-Inspiring Epistle of a Student And a Squirrel who must Defeat a Boy in Ancient China,"Deleted Scenes,Behind the Scenes","Bette Nicholson, Jodie Degeneres, Angelina Astaire, Kenneth Torn, Susan Davis",,R,2006,89
60,BEAUTY GREASE,A Fast-Paced Display of a Composer And a Moose who must Sink a Robot in An Abandoned Mine Shaft,"Trailers,Commentaries","Cameron Zellweger, Ed Mansfield, Lucille Dee, Nick Degeneres, Michael Bening",,G,2006,175
61,BED HIGHBALL,A Astounding Panorama of a Lumberjack And a Dog who must Redeem a Woman in An Abandoned Fun House,"Trailers,Commentaries,Deleted Scenes","Jennifer Davis, Gina Degeneres, Susan Davis, Albert Nolte, Audrey Bailey",,NC-17,2006,106
62,BEDAZZLED MARRIED,A Astounding Character Study of a Madman And a Robot who must Meet a Mad Scientist in An Abandoned Fun House,"Trailers,Deleted Scenes,Behind the Scenes","Lucille Tracy, Gary Phoenix, Dan Harris, Penelope Monroe, Jayne Nolte, Laurence Bullock, Reese West",,PG,2006,73
63,BEETHOVEN EXORCIST,A Epic Display of a Pioneer And a Student who must Challenge a Butler in The Gulf of Mexico,"Commentaries,Behind the Scenes","Sandra Peck, Warren Jackman, Scarlett Bening, Minnie Kilmer, Vivien Basinger, Bela Walken",,PG-13,2006,151
64,BEHAVIOR RUNAWAY,A Unbelieveable Drama of a Student And a Husband who must Outrace a Sumo Wrestler in Berlin,"Trailers,Deleted Scenes,Behind the Scenes","Tim Hackman, Reese Kilmer, Daryl Wahlberg, Rita Reynolds, Ed Guiness",,PG,2006,100
65,BENEATH RUSH,A Astounding Panorama of a Man And a Monkey who must Discover a Man in The First Manned Space Station,"Commentaries,Deleted Scenes","Reese Kilmer, Angelina Astaire, Gene Willis, Chris Bridges, Susan Davis, Jane Jackman, Vivien Basinger",,NC-17,2006,53
66,BERETS AGENT,A Taut Saga of a Crocodile And a Boy who must Overcome a Technical Writer in Ancient China,Deleted Scenes,"Grace Mostel, Julia Barrymore, Jessica Bailey, Julianne Dench, Cate Harris, Angela Witherspoon, Ian Tandy, William Hackman, Meryl Allen, Julia Fawcett",,PG-13,2006,77
67,BETRAYED REAR,A Emotional Character Study of a Boat And a Pioneer who must Find a Explorer in A Shark Tank,"Commentaries,Deleted Scenes,Behind the Scenes","Christian Akroyd, Angelina Astaire, Morgan Mcdormand, Nick Degeneres",,NC-17,2006,122
68,BEVERLY OUTLAW,A Fanciful Documentary of a Womanizer And a Boat who must Defeat a Madman in The First Manned Space Station,Trailers,"Sandra Peck, Jodie Degeneres, Ralph Cruz, John Suvari",,R,2006,85
69,BIKINI BORROWERS,A Astounding Drama of a Astronaut And a Cat who must Discover a Woman in The First Manned Space Station,"Commentaries,Deleted Scenes","Bette Nicholson, Penelope Cronyn",,NC-17,2006,142
70,BILKO ANONYMOUS,A Emotional Reflection of a Teacher And a Man who must Meet a Cat in The First Manned Space Station,"Commentaries,Deleted Scenes,Behind the Scenes","Goldie Brody, Ellen Presley, Russell Close",,PG-13,2006,100
71,BILL OTHERS,A Stunning Saga of a Mad Scientist And a Forensic Psychologist who must Challenge a Squirrel in A MySQL Convention,"Trailers,Commentaries","Dustin Tautou, Minnie Zellweger, Chris Bridges, Russell Temple, Al Garland, Laurence Bullock",,PG,2006,93
72,BINGO TALENTED,A Touching Tale of a Girl And a Crocodile who must Discover a Waitress in Nigeria,"Trailers,Commentaries","Goldie Brody, Cameron Wray, Cary Mcconaughey, Jon Chase, Renee Ball",,PG-13,2006,150
73,BIRCH ANTITRUST,A Fanciful Panorama of a Husband And a Pioneer who must Outgun a Dog in A Baloon,"Trailers,Commentaries,Deleted Scenes","Joe Swank, Woody Hoffman, Daryl Wahlberg, Ewan Gooding, Alan Dreyfuss, Matthew Carrey",,PG,2006,162
74,BIRD INDEPENDENCE,A Thrilling Documentary of a Car And a Student who must Sink a Hunter in The Canadian Rockies,"Commentaries,Behind the Scenes","Fay Kilmer, Jayne Nolte",,G,2006,163
75,BIRDCAGE CASPER,A Fast-Paced Saga of a Frisbee And a Astronaut who must Overcome a Feminist in Ancient India,"Commentaries,Deleted Scenes,Behind the Scenes","Kenneth Pesci, Kenneth Torn, Salma Nolte, Renee Ball",,NC-17,2006,103
76,BIRDS PERDITION,A Boring Story of a Womanizer And a Pioneer who must Face a Dog in California,"Trailers,Behind the Scenes","Sandra Peck, Gary Penn, Sylvester Dern, Whoopi Hurt",,G,2006,61
77,BLACKOUT PRIVATE,A Intrepid Yarn of a Pastry Chef And a Mad Scientist who must Challenge a Secret Agent in Ancient Japan,"Trailers,Deleted Scenes","Sandra Kilmer, Cary Mcconaughey, Cameron Zellweger, Kenneth Hoffman, Matthew Carrey",,PG,2006,85
78,BLADE POLISH,A Thoughtful Character Study of a Frisbee And a Pastry Chef who must Fight a Dentist in The First Manned Space Station,"Trailers,Behind the Scenes","Jennifer Davis, Alec Wayne, Kevin Garland, River Dean, Angela Witherspoon",,PG-13,2006,114
79,BLANKET BEVERLY,A Emotional Documentary of a Student And a Girl who must Build a Boat in Nigeria,Trailers,"Fred Costner, Alan Dreyfuss, Burt Temple, Thora Temple",,G,2006,148
80,BLINDNESS GUN,A Touching Drama of a Robot And a Dentist who must Meet a Hunter in A Jet Boat,"Trailers,Behind the Scenes","Burt Dukakis, Chris Bridges, Adam Hopper",,PG-13,2006,103
81,BLOOD ARGONAUTS,A Boring Drama of a Explorer And a Man who must Kill a Lumberjack in A Manhattan Penthouse,"Trailers,Commentaries,Behind the Scenes","Cate Mcqueen, Adam Hopper, Laura Brody, Cuba Birch",,G,2006,71
82,BLUES INSTINCT,A Insightful Documentary of a Boat And a Composer who must Meet a Forensic Psychologist in An Abandoned Fun House,"Trailers,Deleted Scenes,Behind the Scenes","Cameron Streep, Groucho Dunst, Salma Nolte, Matthew Carrey",,G,2006,50
83,BOILED DARES,A Awe-Inspiring Story of a Waitress And a Dog who must Discover a Dentist in Ancient Japan,"Trailers,Commentaries","Dan Torn, Tim Hackman, Nick Stallone, Penelope Pinkett, Jim Mostel, Morgan Hopkins, Gregory Gooding, Julia Fawcett",,PG,2006,102
84,BONNIE HOLOCAUST,A Fast-Paced Story of a Crocodile And a Robot who must Find a Moose in Ancient Japan,Deleted Scenes,"Johnny Lollobrigida, Julia Mcqueen, Henry Berry, Minnie Zellweger, Susan Davis, Frances Tomei, Fay Winslet, Oprah Kilmer, Ed Guiness",,G,2006,63
85,BOOGIE AMELIE,A Lacklusture Character Study of a Husband And a Sumo Wrestler who must Succumb a Technical Writer in The Gulf of Mexico,"Commentaries,Behind the Scenes","Kevin Bloom, Jodie Degeneres, Groucho Sinatra, Nick Degeneres, Gene Mckellen, Meryl Allen",,R,2006,121
86,BOONDOCK BALLROOM,A Fateful Panorama of a Crocodile And a Boy who must Defeat a Monkey in The Gulf of Mexico,Behind the Scenes,"Ed Chase, Jennifer Davis, Uma Wood, Fred Costner, Kirsten Paltrow, Sandra Peck, Dan Harris, Ray Johansson, Kenneth Pesci, Chris Bridges, Warren Jackman, Humphrey Garland, Audrey Bailey",,NC-17,2006,76
87,BORN SPINAL,A Touching Epistle of a Frisbee And a Husband who must Pursue a Student in Nigeria,"Trailers,Commentaries,Deleted Scenes","Kirsten Paltrow, Sissy Sobieski, Nick Stallone, Dustin Tautou, Ray Johansson, Kenneth Paltrow, Dan Streep, Rita Reynolds, Meryl Allen",,PG,2006,179
88,BORROWERS BEDAZZLED,A Brilliant Epistle of a Teacher And a Sumo Wrestler who must Defeat a Man in An Abandoned Fun House,"Commentaries,Deleted Scenes,Behind the Scenes","Cuba Olivier, Elvis Marx, Kirk Jovovich, Scarlett Damon, Daryl Crawford, Harvey Hope, Jon Chase",,G,2006,63
89,BOULEVARD MOB,A Fateful Epistle of a Moose And a Monkey who must Confront a Lumberjack in Ancient China,Trailers,"Rip Crawford, Audrey Olivier, Kirsten Akroyd, Morgan Mcdormand, Dan Streep, Ewan Gooding, Angela Witherspoon, Harvey Hope",,R,2006,63
90,BOUND CHEAPER,A Thrilling Panorama of a Database Administrator And a Astronaut who must Challenge a Lumberjack in A Baloon,Behind the Scenes,"Karl Berry, Cuba Olivier",,PG,2006,98
91,BOWFINGER GABLES,A Fast-Paced Yarn of a Waitress And a Composer who must Outgun a Dentist in California,"Trailers,Deleted Scenes","Karl Berry, Carmen Hunt, Michelle Mcconaughey, Minnie Zellweger, Will Wilson",,NC-17,2006,72
92,BRANNIGAN SUNRISE,A Amazing Epistle of a Moose And a Crocodile who must Outrace a Dog in Berlin,Trailers,"Rip Crawford, Kenneth Hoffman",,PG,2006,121
93,BRAVEHEART HUMAN,A Insightful Story of a Dog And a Pastry Chef who must Battle a Girl in Berlin,"Trailers,Deleted Scenes","Nick Stallone, Kirsten Akroyd, Jane Jackman, Jayne Nolte",,PG-13,2006,176
94,BREAKFAST GOLDFINGER,A Beautiful Reflection of a Student And a Student who must Fight a Moose in Berlin,"Trailers,Commentaries,Deleted Scenes","Angelina Astaire, Russell Temple, Al Garland, Michael Bolger, Julia Zellweger",,G,2006,123
95,BREAKING HOME,A Beautiful Display of a Secret Agent And a Monkey who must Battle a Sumo Wrestler in An Abandoned Mine Shaft,"Trailers,Commentaries","Grace Mostel, Helen Voight, Woody Hoffman, Carmen Hunt, Frances Tomei, Morgan Williams",,PG-13,2006,169
96,BRIDE INTRIGUE,A Epic Tale of a Robot And a Monkey who must Vanquish a Man in New Orleans,"Trailers,Commentaries,Behind the Scenes",Angela Hudson,,G,2006,56
97,BRIGHT ENCOUNTERS,A Fateful Yarn of a Lumberjack And a Feminist who must Conquer a Student in A Jet Boat,Trailers,"Cameron Zellweger, Albert Nolte, Renee Ball, Meryl Allen",,PG-13,2006,73
98,BRINGING HYSTERICAL,A Fateful Saga of a A Shark And a Technical Writer who must Find a Woman in A Jet Boat,Trailers,"Frances Day-lewis, Angela Witherspoon",,PG,2006,136
99,BROOKLYN DESERT,A Beautiful Drama of a Dentist And a Composer who must Battle a Sumo Wrestler in The First Manned Space Station,Commentaries,"Jodie Degeneres, Jayne Neeson, Sean Guiness, Albert Nolte, Groucho Williams",,R,2006,161
100,BROTHERHOOD BLANKET,A Fateful Character Study of a Butler And a Technical Writer who must Sink a Astronaut in Ancient Japan,Behind the Scenes,"Fred Costner, Frances Day-lewis, Jude Cruise, Jayne Neeson, Daryl Crawford",,R,2006,73
101,BUBBLE GROSSE,A Awe-Inspiring Panorama of a Crocodile And a Moose who must Confront a Girl in A Baloon,"Trailers,Commentaries,Deleted Scenes,Behind the Scenes","Vivien Basinger, Mena Hopper, Rock Dukakis",,R,2006,60
102,BUCKET BROTHERHOOD,A Amazing Display of a Girl And a Womanizer who must Succumb a Lumberjack in A Baloon Factory,"Commentaries,Deleted Scenes","Rip Crawford, Tim Hackman, Gary Phoenix, Charlize Dench, Kirsten Akroyd, Burt Temple",,PG,2006,133
103,BUGSY SONG,A Awe-Inspiring Character Study of a Secret Agent And a Boat who must Find a Squirrel in The First Manned Space Station,Commentaries,"Woody Jolie, Kirsten Akroyd",,G,2006,119
104,BULL SHAWSHANK,A Fanciful Drama of a Moose And a Squirrel who must Conquer a Pioneer in The Canadian Rockies,Deleted Scenes,"Nick Wahlberg, Sandra Kilmer, Alec Wayne, Kirk Jovovich, Dan Streep, Julianne Dench, Angela Witherspoon, Jayne Nolte",,NC-17,2006,125
105,BULWORTH COMMANDMENTS,A Amazing Display of a Mad Cow And a Pioneer who must Redeem a Sumo Wrestler in The Outback,Trailers,"Penelope Guiness, Angela Hudson, Scarlett Bening, Alan Dreyfuss",,G,2006,61
106,BUNCH MINDS,A Emotional Story of a Feminist And a Feminist who must Escape a Pastry Chef in A MySQL Convention,Behind the Scenes,"Karl Berry, Woody Hoffman, Johnny Cage, Chris Bridges, Greta Keitel, Ewan Gooding, Jada Ryder, Laurence Bullock",,G,2006,63
107,BUTCH PANTHER,A Lacklusture Yarn of a Feminist And a Database Administrator who must Face a Hunter in New Orleans,"Trailers,Commentaries,Deleted Scenes","Cuba Olivier, Carmen Hunt, Groucho Dunst",,PG-13,2006,67
